reviewId,userName,content,score
gp:AOqpTOGWckhUx1AVN4iffIBOvvtuPzwTO8BM37jgT88b0alQSUBepNhG-aq1hKdmFPHZJ57gPrQDqQuieUCcSS0,Sabrina Sartain,does not find my area.. amusingly enough the app is on our county's sherriff's department website. useless app,1
gp:AOqpTOF_LUKqR6WR91zr7hGa2iQWUIzR-j4RTh5MP89foF_NyTCF4dmvc0Ap3iKaEbrEmJ6bmuDzxlkS00_CV78,Foxy Lady,Can't enroll on my cell phone! Frustrating. Registation freezes Will try computer.,2
gp:AOqpTOHCBz_LchrGX4k-eBXNCOlg78_vHw_DQAwPUM6h133PmjmliH5i8_GgFMATMV4j7jHb8qRs7ep7uabfYN4,Rick Rick,"Signed up for alerts from WINS, it recommended I get this app.  Downloaded app, no way to access my account.  I'd give this a zero if possible.",1
gp:AOqpTOHu103TN9Ai-4gYUpOonRqx3Pq3oezmCxUwtV02bD5JcfJTzJeOTgmThg5lfqw1MgnjW5tAH881Ia1QlJw,J.R. TRAKRMN,Does not work - cannot find my area and there is to way to sign in with an existing account! Uninstalling.,1
gp:AOqpTOFh7Hgyi_jNaCU_RSZxTToxSj74Fo08Nm6cvbkfGgKH-wUuwt6A5QvzXOfKx9c22neW-unBNorGt1n2Mlk,Juanita Miles,call for people,4
gp:AOqpTOE25awr_7p0GXGG3z5OSX4UI_gST_ZGO3y7K9WPHHfpLo2Cd4ai8khanL2NJGm8PE9dvxNMOC7g4DCzOFY,sharon brody,"yup. load it, put in the zip and get just that. ZIP.",1
gp:AOqpTOGsEWTqKeDNNOQe3LQ0YS7v5k9hUfT9lMI-SDMh8JUcuS7Qyd9rJ911RfpB0iRGaKuyM9x94yDE8V9f1QY,Giri Santillan,"Same as others.  I can't log-in using my credentials, and I can no longer find my agency on the list.  No, I am not going to spend my time exchanging emails with your support team.  Fix the app, or include instructions on how to reconnect to your alerts.",1
gp:AOqpTOGOUXXbJcnDUUIlXhPoe9W74KC8SsYiUnbz7sMUORclNIk--i3nbX5lCzfYzhnhEk7lVGuQ8ocS1dnyM5Y,Stewart McCarroll,easy to use.,5
gp:AOqpTOF_GOMUNb1-qmoN-yZOUIbBOC0hZWzVzb-8kkqgu6R7_1h2D1TPtx2zkiixpQTtm4kM03XqM8LXWRV39LI,Gwen Bondzuk,gives you a feeling of comfort to know what's happening around you.,5
gp:AOqpTOFtYsPl7hBNAOo6xwSVnX0ox3YlbvIxXkX2SxGOiyMN0Z7NEL1JfMPyfwhO7iehVGNyT3GwrCIv8s71ibc,Bob DAlessandro,"Doesn't even recognize my emergency alert system, or my county.",1
gp:AOqpTOE5s_Vbv2IYGOOTViqNm98Qco5TAoqpEsnDoI6KdJ0HLFYH0L5QwAsviMPUyFNP3YUtuJG2rqCoarKZB3w,Lor Hue,cant get instructions on how to enroll,1
gp:AOqpTOGoIRwgNTYk3VZL89zVI5--AM6rDGoXIEpm7Gl7d9W_0KGfjD0RiQNoWUqFjzWVGBGj5d05912ZHTbZ5VM,Ed Cummings,"My company suggested this app, but the app can't find my company.",1
gp:AOqpTOGP5izL-MoWJohbuSCHT5bp1OsqdMLzQv6feMrm7A6va4bCz_KUdUMiwOhGFLecHxz92WZQHrW39SD1Q40,greg mathis,No way to delete bulk messages,3
gp:AOqpTOE4mm37RPkWm_9B6NKTppBxGy-lCXU42saDHxc3Xc9kbfwFX717N4wTyQBXhPD_aGfeUc72y1dTTpta9VM,MikeandGayle Pagano,terrible. no option to find my locality although my county said all notifications are through Everbridge.,1
gp:AOqpTOFrVG4bAjxg0eJzjGljIB_hMPnyWKAz7AYt5CoEBQCoGSvq82Dhgxg8w-JR4_PjEwKtCep9rbBL3rLvWe4,A.C.,"Signed up last year with ""Warn Central Texas"" but not once have I received an alert when though phone and email are ""configured"" correctly according to them. I downloaded this app as instructed on the Everbridge website hoping maybe it's a glitch and with this app I'll then start receiving them... there's no log in screen (like there is on the website) and no instructions on how to add whatever ""3 letter"" organization they're asking you to input. What is this app even for - it's blank!",1
gp:AOqpTOFJm0tQBFhCjKoyHwMKy4SLwJtqr_SUNcVrC-pcYJoiUuc_La2JZVADex3VCuSTE4TudtEeZ-ivim1VZc8,El P.,"I was lead here by my community policy jury, who your damn app. can't even FIND!! even with the zip code!!!",1
gp:AOqpTOFFLOQHj7Wxwb2eYyyrRSKcKnJZ8PByrRDmcPcyCgAEZmPp4Ofd9bpK7pcRZvQZg-eQqQ9PbfRHSWtb3Rc,Angel Brockett,"No enrollment, no matter what keywords I use nothing comes up.",1
gp:AOqpTOGxcipeDB893idNVDzeYXiTyII-EX_3QdYfmo2LyxT4mklGdzDPO3XrM3j47f8Z5tnborNVXgoMABKCd40,Michael Hyde,Honestly impossible to connect app to online account. Sad.,1
gp:AOqpTOF71dOctV--wAy_OEHBnQqCV7vHST3AMutWjAEgc6-hJ5cNAaZaAgYgYvk-pY60dDa2nM3kfsZ95npACio,Oswald Colón,"couldn't get this to work with ""Warn Central Texas"" alerts.",1
gp:AOqpTOEWB4kOwLq1F_xtixcFvNgrfnlRvbomuTy6iFiuleYxgnlJCKlkVSEGv43O7b437joqYn1tsFXNlRb1woc,Maureen Scholz,horrible. no directions and useless.,1
gp:AOqpTOHub5hLwSDsi0AleSzyaLi35fuHJUaFJqj3nwQ8cdG4EokL9xTfZrbu3PaoyL-Ymoq2DfuIwqwQ3wtuBZ0,Josh Sauberman,"The app needs some work, but I have been back and forth with their excellent, and very responsive customer service team. They clearly care about the app and user experience, and are making efforts to improve based on our feedback.",3
gp:AOqpTOEuOuf4GuiYsJ9XS5_Ee7_q8lzn-H3Dj_uibKOdkwfm6C6LP1OEr0HHCh14ImrLkEXWyCqYFElxzfKpYQ4,tow master,I like to be in the know so this app seemed like it would do that...but nope. Signed up with the county giving multiple emails and text numbers then downloaded this app. Not even a test message from this app or the county. So every so often i open the app hoping that the app will be useful but the app has no instructions making it impossible to use.,1
gp:AOqpTOG498QK_4GdioLaCRIolEeNFvQJ6gka2qe2beJ2ZuDwC9EtASpB3wJEcOa4PnOyStlv2TjUD07qHtMoMH8,kim Walsh,says my login is wrong and if i use without logging in it shows nothing in Canada.,2
gp:AOqpTOGQkn3cbjcy_w4yBZivMcio5jJT3aX5l-wrt8_cx7CgOMjeIepz1xjF_9DO5sk4Nmh9guJGINA57SbhECU,Eddie Wieder,app does not work when you use Android private dns,2
gp:AOqpTOGkqnFuibIl5cF6GLHYqGbTCDtJBZY7Tw-0IDWSqkIDumy_MsrUOjwy6wltbjUMhW_I9XlZY-3twFOcXv4,Jens Petersen,Android complains this app using a lot of battery :-(,3
gp:AOqpTOFiManpIbv8s1QoWYIp2Og01CdFlif2vjZIIlC_YrHNizaRcCypohb03U62BpldOTDo2hVPfjFc8wNbkLg,Jerry Barrow,No info for my area of 85937 would like it if i could use it ?,3
gp:AOqpTOHNuyeP1Q8WCz_4z-NF6KFz8426xWj8cubDPWQHViZimYOaO6NmXT5BgSqikE3y2ExR_kP8sEHbot9Sb40,A Google user,Wouldn't let me sign up,1
gp:AOqpTOFgjiwOya3_g36ltVlYpN4_IjY0JDQEPD3O14r7fNNm_vYbnEUwx3xiiE_VdC-5ZdDdZ4smPZupWEBHUnQ,A Google user,not sure,5
gp:AOqpTOGOhDHRrj_uRaDMMGCdo98rWFqkTA0ThhsSiJmJhx0ZgY2Rnh0r8LxJQkPSefvjXsn_htB6GT3A_X54Dpc,Gi Grape,it says my password is wrong and I know it is right! i just checked it with my everbridge notification from my public safety board,1
gp:AOqpTOFjnmPAW5KDXmmybUksOUqDG2ExgEmVKwmoUZuc0kSloNGkwAVoVIEMJoVZBkVPpBa1jjGAlIplmqydSB0,chrystal carey,I've always depended on this app for up to date weather conditions in my area I live in a rural area,5
gp:AOqpTOFvWJBerWv129Cf2ysq8kQ3HcyyyRnJF7EDu99m6Xm4rFam86CM2bbccAFPHA13ZvOXP9RtfFrMfaft_Nc,D D,waste of time...app is not responsive doesnt do anything except show a map. Needs improvement. cant subscribe for alerts so not worth the battery drain..,1
gp:AOqpTOEh7YyenJNCXl5CTft2j30VOrPFZH52H2lxD6d2NsyCZQwsch6vC0joLzMc01p12ibY5eXtTvn8ESbgYBE,eScential,doesn't do anything. no information but collecting your data.,1
gp:AOqpTOEhvdhdZpii84mp05aHolrhVF2t301y4HwHUsb-BuxR1W2TLw5WFehOvcb4tNv5LTMhXHuvLa3xa3QCgfk,M VR,works great....you need to sign up and register on website before being able to sign into an account for those of you 1 star raters,5
gp:AOqpTOEnaJ9AP_5MHqd08EOhzRXyCg94W_-wsfVqhC2qZlDAJXUFleDrtVHUTWIoJru1swGzF3j9m0YY6Ax31oQ,Serina Simmons,can not even sign up,1
gp:AOqpTOGVgdAqi3pnf7F25VrAo0F2FMLoVdz-iq-0F6bcmwWp61QpGdSPe5G_Qb0MJ5aghf39j7VJjZBRI3CXro4,Shannon Spainhower,I really love being kept up to date on local information like missing people and traffic accidents especially since I'm a delivery driver. However I wish there was a select all option when deleting messages or marking them read.,4
gp:AOqpTOFMQ9aqKCm3L_jEL0VmxjCuoMyCt3mynowC3fx0yWFQrSRKuegyeFXaC5mtiXYbo45q-tWxZWaTRL1sTfE,Alisa Snell,nowhere to put in a phone number,1
gp:AOqpTOE-pX0zSgmLhMjCD_ay-xvythA7nUJ1KZaKvz04HeNI_8Y-wUf0GQQZzNxViJjCaENorPchza3a00aO3WE,A Google user,It asks for you to login yet there is no option to signup,1
gp:AOqpTOF7phWWDg5JQ4m3VXTL0gk0I7HschquyuJOIK96I_hc8nAN_w6Rbv15jx-ezNtQrZPmcezDKxCi3kui-RQ,Bill Molloy,Pos,1
gp:AOqpTOH_VCkpnaW_o_2x36wUrtUtz8vzCV9tL-NWVVXZW6lzL62L_OmN9wSqtksjwhP2fvgb1jE-W30nRbw-Q6M,A Google user,"I just hope it works for me! I am uneasy with ""new and improved."" Why ""fix"" something that didn't need ""fixing?"" When dealing with peoples' lives. . . . .",3
gp:AOqpTOFFofWz2QWLNbnvV1KCuZwlsh_DmKF1F3xxELMby0SY8_zSKxwBp9K-nliS9iBNgCZlPAZ4NVTAv5ZZO74,Kou,"Crappy UX. Pretty painful to use, like every other app of this sort.",1
gp:AOqpTOEx33AYptks0vtBZ1M-ZsGFaiBIuq_CwABy5TbeBqmtIXure3u1VMSlT0wT9dkUG15LLBXwEpsPBPdPonA,Tina Shallenberger,Was very helpful with I formation post Hurricane Michael,4
gp:AOqpTOE2IYtmU2wMLwVLUXiyQ3IZ4Lt1NyXg8YhtS3fM7-TLSRn0mJO6J6qW4PpGZEzZv8a7WnEQimfzeLbBrz8,Cyndi Schaecher-Means,It isn't user friendly,1
gp:AOqpTOFQq6eGpwOmciNA9Ie_PFyEs0kogf-qXiJxP-AesScjrmRec54RV6HQiBfY-Az0wd5GpK9OZCM7_qf_1_4,A Google user,App is worthless,1
gp:AOqpTOHRm_8n5ZG5Oo-y_ethyUgQ68McKYyX0KZqdw6Ur_Yi-wZI-aVN0gnJfs4rEH6CzaZ3iaHPcyyQDnYDHVU,Bessie W Barron,I hope this works well I'm interested in trying it and hope I could get some help with this information thank you,5
gp:AOqpTOGrvR-M9Ks6hCHEbCcpvHoiEcAombzD9QpeuyMhgaQsnaGDufQJmJmIsYWgWwHOznmngYSof9LqixAj1Bg,Patricia O'Kelley,You can use the app immediately without having to have an account or sign up. You just have to allow location and you can use it,5
gp:AOqpTOEwF-8XgRLt5h0itcnSLFb7W6NkdaTBSPtMA1xBSKfkwEY5pI3PUo20HzEhywR4f9SMZP3ZHXRkBcLUe3Y,Tawnya Jenkins,No option to sign up for a login. Terrible app,1
gp:AOqpTOEt5balqdwfsh3bAGFXTrh1b_Nwjemnf_wgx5k2rtgao4iA82lU4_ZIHdmeKRnke4XIeqsZgkxmojIXceM,Sharon Shaffer,"ADDITIONAL COMMENTS: 1) Many of msgs I have confirmed & deleted reappear as unread. Why? Very frustrating. 2) Plz add a way for us to select which alerts to confirm as read. Sometimes I receive a ton of traffic msgs & don't feel like reading each one, especially since I also received a text msg from the county govt.",4
gp:AOqpTOE9_pHinlHiV8o5IIUVQnllLcxw-0tGDqcQDPQ7WSeGkNZAyN1bEG9dF52h-NNtmsKzr6r1UEjT2LG_wBQ,Frank O,"Crashes, submitted multiple crash reports. Eventually gets into a state where it crashes every few seconds.",1
gp:AOqpTOGYo2l6V_ijKybe4Qcl62YckUKGfy8zqh6LJvf_f9LoKwzpv4Wq5roYWrrBeKQlh9p16qeg2poNiNlKsf4,Linda Aman,It wants you to log in but there is no option to sign up,1
gp:AOqpTOHBurjm9_FDG3NP2G_98mD1RYeKJuIIOdcARCfVxmB6M9dwQjqTw183Y7b6PqKgkcyR8WJJrcGSpR7YpyI,A Google user,"Installed, didn't work, uninstalled 5 minutes later.",1
gp:AOqpTOH4Zs0i8F5dL94XhjwlV13W6mVa65Ma0whTEB67SAOF4x5YaDths6VH7hrqWBwU2IsBpcOPRKqTcxkOk9s,Ghassan Majied,"How come the user name is case sensitive? And can't be changed as well? 
Please remove case sensitive from username, it's unnecessary at all.",3
gp:AOqpTOG9Va8B-09S3pk75VKeFBhuH9otqgfUrd-R3k2K5UdY9Nl0WQ0wCYH5KbKjmDYDzzCfLHbc-_LZbC4-Ypg,Amanda Werner,Worthless app,1
gp:AOqpTOEfez19J0tMuoenoqIk8hLyJfbooGbfHIlBkfkyrDMeGQvDGgX2-cpKbbKNBdrI8vbXxq-Zow2cfgMf1Yc,A Google user,Nothing works,1
gp:AOqpTOFDAQ_c8rBw8MtFhgMQifqEFbUIuRCf_gTUgJPsRgsS1l_hwLzFRa8hO4aHFkOPA966UCD-brnsxzYetXE,LaTesha Rich,Needs an easier way to delete in bulk,3
gp:AOqpTOG-cCGqYz1CJH6wy2_SrTElpfpTG3R4YSjTtMfdn602FE6G-6a7cZnIkgQhSpG6hn5ltJwf46C3tDmHTbs,Joshua Townsend,"Update: 7/13/18 - crashing since yesterday's update. Not showing any 
notifications either. Update: 1/8/18 - The app is getting better - more 
stable. More customization for the end-user would be nice. For example, 
ability to add additional alarm/notification sounds (the built-in ones are 
not good). I'd like to be able to change the alert sound based on the text 
of the notification. For example, if I get a notification including the 
words 'STRUCTURE FIRE', I'd like a certain tone. Yes - I get alerts for 
local incidents (I also get them via TXT and email, so these are a bit 
redundant). But... having to open and confirm each and every single 
notification is ridiculous. There should be options for: 1. Disable all 
confirmations; 2. Delete notification without reading, 3. Mass delete 
notifications without having to open each and every single one. Also, this 
app sends all alert notification sounds through the phone speaker, even 
when bluetooth headphones are connected - an option to send sounds to 
headphones or bluetooth would be very appreciated. The annoying user 
experience due to lack of options may have me uninstalling soon, which is a 
bummer as it is a tool many local governments in the Northern Virginia area 
use to communicate with their employees and citizens.",3
gp:AOqpTOGJDPpDaVkcCDvG7NRuq6GCAGWxS0zhrxh0fVopvWHv_VxCD2xiAXIjc57cmYv9d-zrHNjw5iwv-UypYbU,A Google user,"A very intrusive app! It requests access to files photos and basically 
everything on your phone or device's! I think that I shouldn't have to 
choose between safety for personal security!",1
gp:AOqpTOGrTUNbc3mShYJg2a3HKD-tBLz5CC8-XtIbvrYqutNd--Uohmj79lz5NoffRnysYdh9XwtlXwk7Yiy4hnA,Becky Connelly,"Just watched it on wjhg news 7 Panama city fl. I'm so glad, its about time",5
gp:AOqpTOFNbyckHJHPFDqUlOLyTQ43OmiFPkzX0jdykAFdbg76MpfIxc3Fi8iEN43CPHaF84jZgf60Vq0R0ymPFYQ,KC Swiss,"Any app that requires access to all that and is that large AND probably 
tracks a bunch of information they don't need, and who is going to have 
time to load it when they're is no power or internet access yeah great",1
gp:AOqpTOFFJBch_1rlEwXImDgSiXJF_7uuySMgGJwA_juQEHQLR5NRlKIF4pzezAGww4upE9CEJjsZvFmocb3pTAs,Paul Spencer,"App sucks, does not let you know when local authorities send messages like 
roads blocked due to accidents.",1
gp:AOqpTOEmX7hbv9Fg9f-weEvjttkPEWWcZVPjOeJHSp-VqdAQmdYB0lyORg9MNQ_T8DWlF2awqqWE7AiRt_BUzig,Laura Burks,"It was useful for alerts and gov messages. But it over road my do not 
disturb 3 times last night to tell me about a tropical storm which I had 
already acknowledged. Jerk. Woke me up 3 times with the same message. So 
uninstalled it",1
gp:AOqpTOHiazhslFV4Yj1Ncn95Gh-hrDjmdqIFCOcyszQZ28vkUh_eGgQmisiPZ6zrPjk6hgeO3rGHVS522V8s7fA,Jim Rowe,"This is a very basic app, but highly reliable for alerting users to various 
weather hazards that affect your area. Input your phone number and email 
address and this service will alert you, day or night, for any Watch or 
Warning from the Nat'l Weather Svc, and alerts from local Emergency 
Management Agency.",4
gp:AOqpTOH6eKnRu8WD3gt8DaJagMit2_fr6n-JDayK0UhK9vom1etN5nmX0JiVLyRT8WcldrNsgbtngCCWgl4jrpU,Dustin Boyd,Didn't even have an alert for the Hawaii volcano eruption,1
gp:AOqpTOGhXM1KfCasBfFQvpzbVtQdgkRNJ4b2iDUYjEQpAXrDbCYRPDbnsRshAoysWctJL70PdGyNkaZPBFAZLdw,A Google user,Today we had to separate tornado warnings in this app never alerted.,1
gp:AOqpTOFIKmS-ToxW7kQJIBbDvVWzppM4-a_vLBEWMcZlNcTV_MWvDu5QsI61_V-UgOXCpDs27n_bdvyT3sP4smI,Suzanne Christofferson,Signed up with the app to get community updates. I get the updates but there is no way to sign back in and adjust settings.,2
gp:AOqpTOFybQwm8XwOSC6mOzvHnDvEljhxeSzkUI3X2YIBoBzUk1YD_H56HqlUwbcYuLw2l0eC_Au0d3BGkO5SpJI,Ian Erickson,"There is no directions on How to use this app. It shows where there are emergencies all over the US but will only alert you to a situation via your phone's location. There is no option, as far as I can tell, to sign up to log in or set your home address. Better off just watching the news.",1
gp:AOqpTOEGLbz_mzvppRc5MHnZ_t797YnRaEslvfdn2s5Wmej4sG6TaULy0zk-ulCnShBKM_i-AZ1p5fL9CCW-yds,A Google user,"No directions on how to use app. Unable to sign into app, when I already have account created. No notifications from app when I enter my address, when there are weather warnings in my area.",1
gp:AOqpTOHVootM_i-_Ab3bNuWepE3hc__Jk2B1rOS-Z0_YDDJ3fNhhmhlTMqV0pWePWkyTcUVRf5-momSXCEmcMR8,June Etaira,Very usefull apps in Northern Va,4
gp:AOqpTOF-rMb3C48oQ9lSuAIAIzZ_s3dxifHp5nveUBkMGTmrIc3sYZW_CkDyKsGlfasJ5pM8D7hT_OsNck6PIsM,Tracy Wyttenberg,Did not tell me about my area when we had all the fires,2
gp:AOqpTOFkakoCfoDRxSqnwcprSJGTDTSYhk-z7o0BWvVEuJGSzCJpRevgaRhwkXq-YhxdVxANqDAACTNauRPC39k,betty spider,"This is a great way to get messages from my employer, especially when cellular reception is bad since this can use wifi for the push notification. I also like that you can get notifications from public safety organizations, even if you haven't signed up for their alerts. I like the enhanced messaging features, much more robust than a simple text message.",5
gp:AOqpTOGyGe_ymSI0CYlijQ2EsFCV0rWB2kgBiCqd3zNC8LsLGclCc64SZjnyAvxIWAXQ0OLYbsOhv6cfGvz3baw,Spandan Ghose Chowdhury,Only thing this app does is to drain battery! Please buy a power bank before installing it.,1
gp:AOqpTOHWdVxqfC8X-QzLnetLKa9ND043hoCklSX5UeIhP2FXqmy3W4MRc4Omlb31MzwDoDL0KrJfUrcqLS-RVho,Tracy S,"Did not like this. I want area emergencies, traffic alerts, weather conditions and school closings sent to my texts, not my email..",1
gp:AOqpTOHYEpDzizVccPL08e0lP1v-lMnINOFf7exdSLwIGkpjKqwGEkXAQ5JTsc9Kqgjv2X4eE3uDUTAewOAbOKI,Jen Borgman,Awful app would not allow me to finish set up. Giving me info on Cali. I'm a Michigan  person.,1
gp:AOqpTOHpVLmdzWPMstXhTr9VJhbwqqv6dAHol9YQJBDvbxZDMp_wZpp_VUQgvINy8qVeI2hp5GY3v7Hy_l3unp4,Monique Leung,Keeps closing app,1
gp:AOqpTOFqx-OizBPrLM3YMqCbs6m6MSxVFjnheIm5CIEMpo8yQMPtfiMUfCBfrByH6r7krxZXBMgwtL8QNb1e_sU,Matthew Galgoci,The app crashes upon loading messages and I do not get expected push notifications as well.,1
gp:AOqpTOHnL11f8r7iw28fY6PItONRSdjfnNXdY1a8g7k0OwltTja2uO1xQ4Zz6tbHDhqSKstKhtNDqebWrvegzwo,supersport2778,Doesnt show anything and this is San Francisco. Uninstalling,1
gp:AOqpTOHiD4m9D1DL86hjs3r5nvNvxTdNtwkGFzk66oox-PWOOzY0i0_c8o7EHxMgwoO-jI8R2v0olgOzwc0H4RE,Bob Houle,"Not able to edit anything on app. Emails to Everbridge and Vermont DPS. No solution given. Deleted account, but email from Everbridge says it's active. No customer support for an emergency notification service.",1
gp:AOqpTOGFq2VaTPPKXsKcYZib_YdlLKZLXRsGCaQqMMbDQCGwx9qvJt5YifJvVh6ZIzh-BX_s1EjIR5XIQiCSMEg,Garry Watson,Waste of time. This does nothing.,2
gp:AOqpTOHwwZRZfPqR5x4FmJVxVmFkOp5c199CqgCDdzLf1m8Xk1U2XyMcZXz4KVZtMQbfY4GONM6ecKHXj5DaISs,MOHIT GUPTA,Why EY is making mandatory to install this app... this really suck . It consumes hell lot of memory and battery . My phone is hanging after I have installed this application .. the size is 50 MB . I don't have space for this thing ..make it reduce the size.,1
gp:AOqpTOG-8-a3Q5Gw1V8QH606YfRe_Rp0_VuxP3_oBz-bBrt3mzLSn52fIid6ESZ_aEN8VWfG2KqQcCYhb7ECmsY,Kami Dimmick,"Can't find where you can get into ""NEW USER"" or ""NEW LOGIN""",2
gp:AOqpTOFspzglWgZSiQ8qCNi5P9WbcAx3XfP0qCTn-yAxILm_uM8QU0N1WtV9MhDnDtwc9LwKsZ6Tn6Wey0O28RM,I DM,Difficult to install and then kept crashing. Unusable.,1
gp:AOqpTOGLLdZZU2NtnkbX2CzK5w4HsumiesVDH8DIbtVnzCwaio3g-4jUzQZrg1-GXzPSZ6jx8iqHeGrTrnBq2UY,Eric Parashar,"This app only open and crashes, unless your looking for an app which only function is crashing, this is not for you",1
gp:AOqpTOGqF6bm_XfgOKErQ_i3DLlGEoKERwJg9G8HtsiCnJtp9NWt66MhLFBCHZXMpJeW3Sy-Se0We-AIhVQmm4I,Jonathan Gereige,"Always crashing, can't even register.  And it's supposed to be for emergencies, terrible.",1
gp:AOqpTOECIItMLs6P1aInHkIZTcc0rAod_Sr3Idfy-Tm5q87vKK9dzgejdyjz0Epbv6yfpIWhqSLlPillKXPWba4,Adrian Martinez,No alert was sent to me map is terrible way off.,1
gp:AOqpTOHaWOmc4XlnHmnqYan_t5ZSGzzPrXHVWomTg5_mXt4rc1p9X7rxYt1eepHyRb7FMFso-EnJHFw8-7XJLco,A Google user,Alert texts,5
gp:AOqpTOF0Ojn-Vw-0xVvyMQOSwcfcXjmXvsCaui38YEQS4dF-NK98SDlAAnhT6khsuJST_a1S9h3aFfUzfpxMqZI,A Google user,doesn't work as advertised. not sure why my employer selected it. total garbage,1
gp:AOqpTOG9hnLsjGR4Qig1bjNnnt3mMD8khI-k4cROarjgHXhIpLp-r6dEJr2O6U56SxmYw6qYARDQ5ekWt8f2N7w,Gloria None,We just had a crisis and I never got alerts,1
gp:AOqpTOFQKYiXbB3_zsLDZ2SpOtq1JlpW8To8ZpmHBtCIZIypgI2B3nmX1X5iba6MvPbnyOFtaTaNnWPIgR0xM_A,alex kasanda,Terrific,5
gp:AOqpTOGoYESWbZ6ZsoYL_MTyYZMtISCkaM6Z6cmeTurd48FMvIMLwKMXoh7jMXggx-9GefQh29guT2wooKDxlxA,Joshua Graham Messer,So much to see! More and MORE each successive day! Yay YOU!,5
gp:AOqpTOGhgfp8zYU_J8qVcianHL_O32nomT1JMCE1L4YiPACNHTM5xt6BkZZWqsmnWCB35Z4r0SXoEKduTH-PnvU,Lisa L,Doesn't work. Does nothing,1
gp:AOqpTOHNdImIKoaNT4xSQ2UbjHwRVF6wVC9BiHFsDYA0Vxhbm3ZplqG5_gQ9E2LVNgl1Na-BF2sWhFF9nDSe9F0,HB W,"This app is garbage. Downloaded it too keep me updated on myself local Emergency Management services during the hurricane. No updates, no advisories. Total waste of time",1
gp:AOqpTOFLdYtZzMk8nHN7RzNAss_zLRNsqZj1GY5SEyxVNT3V3bBbkf8LJo4Gc3O-kJIddbGlgglzId5rLQVfZ7U,Peggy Ann Meltzer Homs,Could not log in..........,1
gp:AOqpTOHt0iximlTgEZOVQLuSZhz576p4mcPvffGAdLtI7ulfotdNnHk0OHgi26lwquvCsYEX_yZo8s_5XWsYxvU,Leslye Nelson,My 25 year old development is not on the map so it is useless. Update your maps!,1
gp:AOqpTOG_MAao0hcyYXiAi1EFMbTcN8JzyWey2g7FTX3LQxXZ16NZfhA2ucJopzX-x58DlXP4mINkHYLm8DaoA8o,Maria Ruiz,Great,5
gp:AOqpTOGvAg_B4rjJCkFHCrf8VFNT7AjXM25WQmdRgbceG5RMCxuM8D0XbytWOhfq1cl5F9nMR6E8Plopm3Tnawk,Araceli Hernandez-Cruz,I think it will help me,5
gp:AOqpTOH3_mzgb6lr19mM3LkgQTkHTeZY61BZRGeMlmjGS_9O3rxJaFYSz0W844jh7em7_1IozqgeWr_JlSf0_7U,Dayna P,App is not doing anything,1
gp:AOqpTOEVKBRzUaxm4HoH_IbK-_GNgjsaAD1pwmXcWDMiH9GYpMozt3e2xAFo-3m58YxMRaYFDF9ZKkhngxlUarQ,A Google user,It would be nice to be able to group delete messages received. Apart from that the app does what I would expect.  Update  Would also be nice to have a widget for the SOS and Check- in functionality.,3
gp:AOqpTOFeYj9LUGO1-HbEq1zCLn5170vb9bIC7KzklivIdy4QnvJ-oS4fJNUVvK9DS-ISistMVsfprsh-lS85vIg,A Google user,"Stupid thing installed, asked for my address and just sat there.",1
gp:AOqpTOHY96-GGSjemW_tyyl42oYDF1RCTxzSVxIxSm6PtMShfYcbB_OBZYqnDikOm68ijGT_wd6noOlD-PYhBDo,Elizabeth,There is no way to delete multiple messages. It won't let me swipe to delete which means I have to press hold then delete each message... I have hundreds of messages that need to be deleted.,1
gp:AOqpTOGBvbzAdopAGfk05SYasVTI7JxzksTMyv6enRYbejbM0lB-OgL3zDjsZaiDI7m7i11PiobBssz9gjWGtms,Ray Parker,"Update 2017Jul21: After 10 days without a working app, a call to their front office support reveals that the current versions of this app will no longer run on Android v4.4 (Kit Kat). It would have been nice if they had responded to my prior notices, or simply put a message in the app indicating this. Very, very stupid people behind this company's IT infrastructure. My county, who pays for this, will be informed.",1
gp:AOqpTOHXzHpcB97xeQtHCyIIAAn156_sYz-UrbvcpIMiWiHqg8ARDgGd5bbNU-zTlMa2cJ_tb0K-arXEZtAueVQ,Darryl Middleton,N/A,5
gp:AOqpTOFCPtKQ9KK11YruGf1c4I3Bwo2fiOqp6p0bmBoVwdaZ1OqUNbmCeFL9LmshEz9si01h04kSvzj8MnCFLzg,Mary Kennedy,"This could be a really useful app if they can make a couple of weeks in it.  First change the name. This is not an app to help you manage your contacts.  Instead it sends you emergency alerts, like ""Tornado coming in from the south,""  or ""fire over on elm street.""  Lots of people could benefit from this if they understood what it does.    But the second improvement it needs is to offer a method for turning it off or adjusting the settings for things you personally need to know.  I really don't need to know about every traffic tie-up in the entire city, especially when I am spending the day at home. Plus  this is designed to override all muting options and all do not disturb options. This could be needed for a tornado warning but I get  4 or 5 alerts every day and so far none have been relevant to me.",3
gp:AOqpTOGQXa0PoHtQyHn4n0WvN4TlxkOU5sFP85zXVrVUX4NJeJlUBPx99pmXZpYIOc27QhnvGDfc9GypBMjMnq8,Shelley Hendricks,Crashes almost every time I use it. Its only value is that it beeps when something happens so I know to go to another source if I actually need info,1
gp:AOqpTOEN_oDbfTVvSutFuNHNkrhS5EbS1jSuoKZasGCyyG8t8bEghpMNhzNwA5XSgCk2jq8nTPkZrOoirNuZzBg,A Google user,Works  great thank-you,5
gp:AOqpTOGuybzynYVk0xGE-hC51JiFpT1oNN7dm94AZkDlfn4VvdduYNHt_MsnaePLQgQSskhCEe81yjClTZzeEeU,Michelle Ivey,This is the worst app ever I deleted my account and uninstalled and it's still sending me text about a storm from Saturday​ 5/27/17. STOP NOW!!!!!,1
gp:AOqpTOGnGmWd9F53U5eUEjmmv8ODFsAZrfE8FayKI465GHF-1cWFHriKM8v9hnOwWhqrwRONMSDU98jBrazSHqY,Axel Foley,This this new program sucks. I miss Nixle however I can't log into that anymore. I haven't gotten a single notice since installing this.,1
gp:AOqpTOGfTtPE4TULpzh7MecvF1vFtNEY-cVQ5jJ4r9fr5KJqUdLkX9BEBjmg2Yb4pJuVRQqIy35tZggm7Rw__jo,R P,Would love to be able to add my own alert sound. Default is to general. The others are NOT what I'm looking for.,3
gp:AOqpTOGbx0jEIP7_rKWP6cq1IPFO9NyAY7mxlBfvaD11MkWC8b4QrK6VPcgIZ82YMFen8vRYhhyOcfoE4677c8o,Atul Mandal,"Good for nothing, don't know why they give link to corporate employees when their product do not works.",1
gp:AOqpTOHpRaKu5pQpE0r_gwy85nZTQ0pzTtsAgwpCg0QiFIgpL6yRiSr6FA7Iz2VqxMWZSQTy0QAVJ2vUl73f40Q,Corey Baker,Amazing application.,5
gp:AOqpTOGEFAgpiKTD4fcovHsVRHLE9Z-Lx_GbWO-5uulZl5wJQ_kRUhzN_0jmSDTtvJGjCeP9pj13bQ6T_eONrz8,Eathen Yoon,This is good enough,5
gp:AOqpTOGbpLD8hu4tOD2z8BR7qOeWrZ5hCDzGJ4h4QjXu0AK5vCdrx5pxSd2Z6nB5ryLciKXscQLDl3373p-FE-g,jesus crespo,Great intrument for know was going on.,5
gp:AOqpTOHxd7jjna0yA5WKrN2x4jH_UfPHGXdWiH0PR7uFUbcPMVNm3xYJSh-4Na2DNLNWLpCdTP9Oe00VaUCIyxQ,J S,Cannot log in using existing account info even after password reset,2
gp:AOqpTOEHE821jrneiEZcdlkMP84m-yGxk6rN6RjmirkpYdEQz_7aTKmACuJJijxlNkOk5ZiS8hOAWiIL2dx9lz4,Spencer Carreras,The new safety map kicks a**! Very nice design. Allows sender to attach docs to the message which helps for natural disasters to receive evac route maps. Very cool!,5
gp:AOqpTOEwyrj6LiEfTHRwtiwJ5LHFWdW7JJ3pGcJ9Ij_d_lQ3QmgC9mw8ZCeKEl1FiBPAAlnKa59qGmo41bMH4yI,David Baker,Solid app.  Snow emergencies alerts prevent you from being towed!,5
gp:AOqpTOGp6Q6cGK003tiAyKMq_FEfufRgsbchzR9EayqXhmHrPEnSq39Ou8GF7H8HwinqYnfF6zvlojIqG05vGcs,Yang Emy,This is a great app,5
gp:AOqpTOHtgiMmqvzHK5R-88gR7g8YPd3zPGjw1M5lMqcfqbevRh05twscHhdKDsqEU1jPUebc1DjGKoafij7wz1I,Anny Zhang,Great app,5
