reviewId,userName,content,score
gp:AOqpTOEKcTD_Q8Q4CfDUpFVPJZ-IY7aYZxhnKUWNf6tKcnYoE2QglPEnRKYUuHdoSwHqewVV44YJa-tur0j60ro,Lia Binetti,Doesn't seem to work,1
gp:AOqpTOHAxv2GmXQUH5JOJur7oFzIeYz6zLXrCUReRKtzmxotpRSe4_FkVVK2-ZzhS8AXlMpQp8cEIsiMj5FoxJ8,Enrico DiNatale,"Slows phone, runs slow, takes up internal memory. My phone has little internal memory, Can it be moved to external memory?",2
gp:AOqpTOFvZ_4WBpwshoTI0iiWxFqP3qPy8n7FDB5f90AlU3STHgtjAN2wmW_UjQr2FElYsK1eKNqwMDLHM_2jNOU,Dorothy Beatrice,"I get multiple alerts for the same event. After I acknowledge an alert, then it is right back listed asa new event. Frustrating and annoying.",1
gp:AOqpTOHtj5x5DTLwatpXu7hs19UZa9J0Y6-JpGLxirKMF02TE1wFHCvJkKv1ePaMjfrnEBtl9XBX9ERA6If8a6Q,Beth Palaj,"Just updated, won't even open.",1
gp:AOqpTOHaXLY9GucSVyjPAuNIwQFL7EnOrPTkaM-7zH70kTt_Q1BAsycltROZHXh5yBc1-0Ty_yuF0MbgnJGPEXI,Gloria Wilhelm,Good,5
gp:AOqpTOHG0GLLECkFse52GdQOmQL9LBsNwHpshOsruWnraGKNBPYmO5LWN3DSlJWlrFkc1Drc393Uh7qM-O8T1jA,john whitacre,It's a great idea but far too difficult to setup. I couldn't figure it out.,2
gp:AOqpTOGFg6Byz6S7rzNhVIcQzjxvsIQMXYUCebWaHNu66eyCLeHJLuzWVplqDWSuu12BUOKvAc5ZcoP0ehbXe8E,SD Saw,"Got switch over notice from local emergency svc, so signed up No logout option? Did setup once, then it sent code, had to start over.",2
gp:AOqpTOFMUF-gY7EdHtiRkiOK8WA-42uzhMu0VrP8DpmsvoOfcKTwwVWqfX02_xMbqjiO2thhh_-tEwLhwNQCXkA,Mark Krauss,"N.34, nnk , and Mmw56 m v.",4
gp:AOqpTOGTGJ3b8yYL56ubsD9A83XIBkE9bKWQHgaDMEWK5lEeQ0yibpOoPzjmGgdIYUbH5_ECNQH6Jv5h9YWazUM,Jim Tatol,Useless,1
gp:AOqpTOExrtZt4QfVrDyV2YeSwLwIu-9t6moqPcBFq2fqDX7sgneG6ImZrHU4RrGrxwsmuWGg_JM-KdLKvpmrGN0,Franklin Mcclure,"Asked for my code 3 times, have not received the code yet?",1
gp:AOqpTOFgfcuEASPgG9stqhpDqsBYPqf8YkuE4XFm850GqyWnexB9CKH4CP4tdwXUbjNmiOOPjorN-d0CYW4tDmw,Sandy G,"We had a storm go through last night and I've been getting hail alerts all night and still this morning even though there are no storms in the area. Besides an alert, I get an email notification a few minutes later so it seems my phone has been going off all night long, keeping me awake. I want to keep this app for emergency notifications but not if it's going to keep me from getting any sleep.",3
gp:AOqpTOFQGXSjOOnimgu6efdMrbdcYTLPxJg1Qh2iNqM9NoJ9HyT8X7QnJOnYkJrYShR-1hf1y9CiZPFIftYp4iI,Doug Kerr,"To delete old messages there are two options. DELETE ALL and SELECT AND DELET. When I use SELECT AND DELETE the top items select box is covered by the dialog box. This makes it impossible to select or unselect the most recent event. If I use the SELECT ALL option then the most recent event can't be unselected. I also don't like the way it showes ""open"" at the top of the detail screen when it is telling about a road closure. I have to remember to check bottom of screen.",3
gp:AOqpTOFsh-e5gUrujeCB9o5dAtB_FheI7fwjBGZfGHkLIxnQJXrinuQSYIcyhJIlgNvLLoz5F9ob7oxtnNhixWk,Vlad Dragusin,horrible,1
gp:AOqpTOFACadnPV6NWty9H2XQkT4j120y6UY8h1BHIDMCbw6YTkbXcrRZjy06tNzNaBdfRzJQJ6FwKpxYVhi1qAU,Chrissie Albright,It won't let me subscribe to ANYTHING!!! And it appears that it failed to notify anyone during the Alemeda Fire in Oregon (September 2020) This app is a disgrace.,1
gp:AOqpTOFmjYzAoj9GSBQ1SP7vKp2c7d3q92uWa3ZXTZT0GiT3ga0YoYfigvQMTLcM9JjTeGmaOQOLhALP6bkL1w8,Kathy Hester,Have tried to sign up on my phone and tablet neither work?,1
gp:AOqpTOHdoa1Qkr229wfNhO9OU_o3nEGHZhvmPiaKivJY9SJPe34TD8PCm7UMtuFmz95N2ZxPJpEPRykf10WpdSI,S Kang,"Confusing setup - New user, no alerts yet. Was directed from local emergency services. If you click on the link saying you were getting texts from some number. Even if it's not the same number. Put in your cell phone number. Put in the verification code. Search by your zip code (don't bother with name or city). You may have to try a couple local zip codes. Then subscribe to the closest service. It will trigger some texts.",3
gp:AOqpTOGdAMSWvzU3K_W6TjxgZZEBOxWtNFtxGinV5i04D7u0swoE0WmxBgGpvS3hoR4Qtxg3ybbct-dlwvQ7f54,Jaz Volp,No where to sign up on app. When I sign up online with all my info and then go in in app to receive text messages it keeps saying I am not signed up. Online it has Contact Bridge but says I'm not logged in when I am actually logged into my account. Stupid all the way around.,1
gp:AOqpTOF9IDK-IupDjT_58Pv7zrfBdpEsDwCFj1sDL8rxvOxXCQScjQWM5zsnwhCWghVJRoNNN5SrT-A2baIEQwA,Axel Kratel,Would give it 5 stars if it wasn't for the fact that there's no way to login to an account previously setup. When switching phones one has to sign up all over with new username.,1
gp:AOqpTOGTIXNk75bsc_erxSeLLqyr5zrHI4WZRDVX2MV0uADtUwiyuMmFeQtqWiRo-MFoA0zx5XuXpioU1Ippp5s,Kathleen Bennett,Have gotten over 100 hail alerts in the past 24 hours......no way to shut them off.....horrible!,1
gp:AOqpTOFV6R2m3P2N3DYT5zo8BlyiDlE2ivqf3kBxoD79ThRow8ZTeh6Ic1ZNxmH1Om9f1F7CO5m87-l9LSyG7Hk,David Nelson,Love Everbridge!!,5
gp:AOqpTOHRUtfCEIkImfpuyvZr8CqTTB0eAGS8tPoWjdB6ETUQmrpbFPK0KgZX-w4P3RBbLCnSt1IyP6lAejVrufA,Kent McConnell,"Kept getting notifications about voice-mail with no way to play them. Couldn't figure out how to cancel subscriptions either, and I work in IT.",1
gp:AOqpTOHs9WhMmCN-FkVz7Xl3K9c4ntZaKDZ7u-p26EOn-GKG7saMWoUdnFFIBweQi792ojQKflFmcrLMtZEnz-0,Anthony Rosario,"Horrible, it is not user friendly, waste of space on a phone, CUNY why are still using the app if the governor stated you only need to be vaccinated to enter a CUNY school",1
gp:AOqpTOE1bqUDYPv5af1wsuviA7fov3OkexrrJIWBfXH-Ma6jJsJQW20Z1u3SJ3KGFuetObYbD8e4Inlzw1FuQPs,Marvin DeVore,Uninstalled this app and still kept getting weather reports about every 15 minutes that wasn't even close to right.,1
gp:AOqpTOGYx4NefNhu59vaVBJAJwNJSGkK_8t_RoE5ubVciGyOSjU6mITVpRFJZncm_C9vsswHiTBKTkk82aoVUDI,john klang klanglikeabell@sti.net,Great that they send these alerts but baffling why they think people know where something is by giving road names. I've suggested that they either link it to a map or say it is approximately 15 miles southwest of Ahwahnee or something like that. They can't seem to get that done. Sad.,3
gp:AOqpTOFVJKDEvOJ738AoSal10G9zR2rh8mOr92nS5cEA3LxzdrdhWQLE6ids2LRBWx1Zl1fVvfIQd7kZSoUnwKA,L. Sullivan,Not clear or user-friendly.,2
gp:AOqpTOFkPdIUE8frZkiBTsuJoBW9GuYIiXU3sEotzKK9hYg2h7uX82MkFbx_0kBLVs5ZeKKVwo4VaZ3vP7dMoBI,Darrell Wolf,I ONLY WANT LOCAL DATA,1
gp:AOqpTOEBZzLU3TbuxrVWPs3Fy74QKeQcSclRy6UyubykM7ETpxtB5xUix23NkUlbDckE6ed4P6paLTwjguZ15WE,Robin W,Won't even open,1
gp:AOqpTOHYIo14aSHuaZ7OzMvA2MNGPbhURWjhK-cJ2_4pBhxPVYuvbLo4qLtLNSezcN_8GYECf5GGVoV16mWYxN0,Debra Anderson,Went to incorrect location.,1
gp:AOqpTOGv4eLR3f47euVH3Ygd8b2FCciFGZhaAVyn8gcoEA1-cOBOl2s0a5nytTqhDKn5t8jMJCWtzXM3XCqBZ0E,Sebastian Broncano,Can't even login. I changed my password 3 times already,1
gp:AOqpTOEdThVR3myaQPmDx8bQIgpFl9qxElqfTRuBm_3Mhi7gs5kFnH50y5npK_4kB8Ore-2fSKmoaBjWvAI5880,Tim Gilbert,Totally useless app. Tried to download it four times. Can't open it.,1
gp:AOqpTOH1v-Pml0KM8ldsvG_FTT3kj5jkaFntGx-kZItm22vZ7JmT_yt3Ib1-GBZxJAXFFIyPY3OLGILPROA2Qgk,Elaine Sanders,"Failed to find my location by zip code, city name, sheriff's department, home address, or work address. It's useless to me. Uninstalled after 10 minutes of trying different options.",1
gp:AOqpTOEhRKT4UMYO98UNiwwVgmN-UD4t7a6lRlf61qQsCKWCJf0qRNM82uDmY_LXf9unTsAoete8r5ufxshCfoU,Patricia Kalamon,This app keeps stopping,1
gp:AOqpTOETrae8G3hPfi4AQ9fQqcEmJjRzTqN3jD7r7KohGK-5B5XQVPlJQJEDQFSkgasS74FsC09QiNdgBPMopSw,Michele and Darryl Burns,Not easy to use. Keeps locking phone up ..,5
gp:AOqpTOFjnpifTjDpDs73w7AVwsoKQvyqrIgoBEXWLL1M9I5A9LeZEwGqmBJpZ7HoYlX0SpMAEAuH-87l6XgVqZ4,Abhishek Gaur,Must have to get the emergency alerts,5
gp:AOqpTOFPzveGhvs7zVC84PCDQQT_qBxkJR-wZacJMVHeSGAf8ZVpAV9C9caCriB573y_1yw_krWAbNow1UPhmnE,Bill Winter,Today it asked for new permissions. I denied it and now it locks up my phone when trying to use it. I've been using the app since 8/2020 no issues prior to today.,1
gp:AOqpTOGRck-tkoBFhV8WVV57ohrDscVxa-sT2EVQZXWKpgE1Aelae8yJUvWpM2Qff4vCjZP0fCbcssdnBq0hDMU,Margo Ortiz,In the Creek Fire this app was a necessity. Won't be without it...EVER (BRIDGE)!!!LOL,5
gp:AOqpTOH_einMwIYagkCtV8r5pbdVDgTT8sk_nUZh35pw56NOV4uTHuUh59Eoz5LfGt-oTKT85rZIeuGNbGGScas,Bukhaari Farah,Cant download the app. System is vey slow. Keep loading.,1
gp:AOqpTOH2FbzE8hoUIOAkSBFoB749vGWcWDByHC8hfRT0ODaCRn2QmPQ9obOCrBrJ6uFjnoYU2inx5uDzytcJOLw,srikanth chowdary,Stupid app,1
gp:AOqpTOEsOI6vdiVVi7Ukr0zvLQ0OrZPQVKrjNk-9p297rLALzYq4hP-cIT2ZTHpDXNB7_kLmzjMfD_Tcbt3NE7o,Paul C,"Stopped working, will not finish start up",1
gp:AOqpTOECKMFB1AqAnij34cPZ56_TCQYDbWiAV1aglQl6ntAEK5tGj9XYlSEhEt7JXpPgEYiUwsiU1_crbCZjGj4,Dyl Pickle,Doesn't work,1
gp:AOqpTOGnVJRF7NPKuTWO776v-XraujYXFTRLacJ9NGGGwuTfCthoTK7Yj-SRt-2saInPNVZ9w0sIDZUqzx3b-x8,Evelyn Blandino,"This app replaced Nixel for giving information about crime, traffic, emergency management, natural disasters, etc... So far it's not exactly easy or convenient. I do seem to be getting notices. Not as many as I used to on the Nixel service, but I'm sure they'll flush out the kinks.",3
gp:AOqpTOEbd0VoIZc_5gDKlh1AkxEuZg_ZUAhq-CvStTyfEO-fGlSZXI9Ityo0eHieWZF81Slv3ixRw60V-BltqYE,Sue Short,"App keeps stopping, not all notifications received.",1
gp:AOqpTOGFNJ2-coW-kglDdgLynCvtwvE3FY83TzJsQzxcEKdR3quc0tgI86vGJzIA2LcIfBl3PT2PwfhT4TuPFhs,mm ee,No sound notifications very bad app,1
gp:AOqpTOFWoWjgKMtuslPDDYcKOQAHzSEncaMjI5sR1pQPU4JxqaN9CMWHwLQtEs-9GlijVM1r-8PWsZrzN3y0jEE,MILDRED BROWN,EXCLLENT,5
gp:AOqpTOG7jRVYbDofq_XJXfagnNfRWfZu4DiQDSWdV5kyFlu_0MRDTLCx_vV9WMatK4muCh1pFzLY7G5uAFnyteE,Norman Tu,Got false rejection token despite answering screening correctly. Campus security had to waive/clear me through. Unpleasant general experience of notification delays and now this in the morning.,1
gp:AOqpTOFmZq-OBpDsZo1OsRq3JOLDAvGAL4CJTfbSmySKsU7qcjmbnFuxxvWBibx2jmA-cUMrYPqOXH8ZdA1ynsA,tlod9,Great,5
gp:AOqpTOE9qByk6aR-PastxBgRgRMXlkMIzdSBrXEIa1T9s-FDKu9IsrcRA0hjXYFCDbImB_02bCDPUNTmkCpwNio,Walter Uehlinger,You suck,1
gp:AOqpTOEl0BehucKPZ2bJ2zEuBBzrZE-3YlLsXUIPxOqUVXonQWgnMiKaKYkmiUxrKUy7i6tfWmNEaba-Tkk2HBQ,Shandelle Williams,I cant even get it to install,1
gp:AOqpTOHwg5upOrboOzfaXB2_urhwPJEo_coelJWBQOEKySIQ1V_Ts9odOtbZiGdmUPih-uC5-cPRx_Z8f-rBnjU,Barry Quine,Doesnt work,1
gp:AOqpTOEQjLF_mYALIOrFPcyKSBmkXmfPA9saNF8LP4L3elBYvP-ctZCH7xJVpvhYr6WIxTyCcp6a7Vfn4IYOwjE,John White,"Well, so far, it just freezes solid at the beginning of the subscription process (I have an existing Nixle account). This is going to be great!",1
gp:AOqpTOGc1cBiHTj42FNyuAqVBlnysPAmT_HP2zo3ueFbnnp2a3a-AEhybHQ6lXeHDcxXt3zEFt_zbC3S8awERAc,Julia Duncan,Who let me submit the verification number. Tried 3 times.,1
gp:AOqpTOFrk2RNuab_qCSytzOXw0lbM1rSDSvk9hikNpeodujpKusnt8c-LFc1y3qlScKxs4sqEt1yHuZk2I5LOqk,Vickry Kayser,"I got absolutely no notifications for my city, much less my part of the city on this app. It is completely useless in my opinion.",1
gp:AOqpTOH1r_TCISWhWfGiBsxZ7rI9fmhFGfisrsyHsXAV0Dq3CgEa7J2xfUv1VC-hvZ5x4czU33lnH_2pSlrtUek,Jack Phillips Lord,Can we have the ability to mute non priority notifications rather than just copy the phone settings. I want to be able to have normal notification sound on phone but mute everbridge non priority notifications :),1
gp:AOqpTOENzjxW53VfeoiEhdM5g1lHmt1oNrZ-TgkzOyah8jqpgTJ6Ku3AADKFOA4UUh0Mngz4W8ZTL1PIfHFz0t8,Cheryle Ellsworth,Can't get rid of these people,1
gp:AOqpTOH2qRxLaLDZsGzwlJsF8yZxfHMCcHk0x8PGD_I0ptctjCZeGv2SKF4zbb0W57oeUigQhb_zoD3MS6lJR08,cristina novoa,Keeps crashing,1
gp:AOqpTOHOlzJo7wv1xQsQOJO9AVdixApXREoDdGcFXyfm3qvDvVsN7jz7zSi1sLqIwiz3J3BUUC7Dz6vMbmWlJqU,raymond tidmore,"Uninstalling, with pending laws of phone use in vehicle response to confirm warning notification will potentially result in a ticket. TV apps and weatherbug beat this apps alerts anyway. Pretty useless app actually.",1
gp:AOqpTOGfdOILIneTvJkkzdBz927pBv1k-A-ohZW23yDKC97l5-cwlayXo9Wd4x0b3t7o5V3LKb_lE91d4uMYkl8,Jack Turner,"Useless, just went threw two tornado warning in Rutherford county and never got a single notification from app.",1
gp:AOqpTOGktbCXA5XZpRQN-4k_YeJIOz8eJYIl6ZKXycnr9Epk1R8jJiXeHo2XQa7lXyCRYwOpJsaUM5YX6uAROfU,Hannah,"When I open the app, I just get a black screen.",1
gp:AOqpTOEiV1XbLJQiCtpReppyinIOsQnCFBo_coVzDGaxQ2tLTFR7E5KV5UP0JjlG4dc29gU_fBw-3eaR5A5iw7I,deb patterson,Emergency alerts for your area!,5
gp:AOqpTOEfnZ2wI8Nti1wduQBGP7cru6tM-7agZl-D3fK5cl9ElD9zD2TsjviweReBc9dHsoZZqJD7y_peIexH9Lc,Darina Qafleshi,"I need to use this app for CUNY Health Screening. But, the app is useless, because when i tap at ""CUNY Health Screaning"" nothing happens. So, in order for me to have a sucsessful submission, I have to uninstall and install it everytime i use it. What a pain!",1
gp:AOqpTOFrfj5BJs93J4UxXnn1BFEFFoaFqolE1GpbMbRZfqCN6xThMaUlPhNc59ETGca8iTC9GTrgvBnA7pLJijE,Rayne,Can't log in. No results from my city or surrounding cities,1
gp:AOqpTOHu70VWTDxmm0j_M9zYKBxTHc2KxfSskELWUvObOO61rZ-lrsogZeo4SOiyEEA-dLf_AZZOX3K9cbWAcA4,Thomas Greenberg,Confusing,1
gp:AOqpTOHTHt1RFpdqfuZZIBpHezg2enkPsS5CKEB8M06JQervORApn6u9fFkR1Ag2cyQ0Y3pq8f5HGsW146J7De0,Madison Hardisky,This app is straight up unusable. Tried signing up for covid alerts and all I could find was a weather warning 50 miles away. Hire a real programmer.,1
gp:AOqpTOEyQVrMFZm1yYHVpLthzX65vIRQ-3ujWA7iN1LgAN_fN1Zf706SzlKN-M75EzE-Xbi_50l1kWOKGLgITtE,Trish Morris,Excellent,5
gp:AOqpTOGhdG3072nHwJ-8unTWAuftHBAmpFPZ18qZWq84Qw7DgnwFovpuRG0omxsk3GRYnvUT4WF5Fh3vJKSc0DQ,Pratap Azad,Does not work majority of the time...,1
gp:AOqpTOGNfdh3tPGn32eapRmvWbJFX8CD35vzoZ3IsZvpjT-9WEyLZ_sxwmBaEKlnDmbpnfqW8t3HA-gXVXQDhXI,Dave Longey,Very unprofessional app that worth anything wont load,1
gp:AOqpTOFvcxS0_S4DloXAvfKYrPDAdfsYJgggb4x9dCtGYmMrE9S3pBIwOSjPeArK7ymoo-a_cZ4nFIYEnYvllww,Philip Beckett,Failed to link my mobile and email to the account set up online.,1
gp:AOqpTOGefVyzQ3vfr8C61p6cyRsadtVlZKwPFeX7xSpOGVdVjhC3oEhALseVrwqcYbK29Z6gg4bh5_Kfmp2IbsU,Helen Demay,Timely reports.,5
gp:AOqpTOGU-myYzeKBSV5uregHtwmhdfsdgluw2rt4iBgED-S63lm9nPZKRpzbsvWxYB-48Jy6VBAMKHt993ral5c,T Rex,"Having issues trying use my 4 digit pin. Keeps telling me to go back to the search bar for answers. Yeah, right.........",1
gp:AOqpTOEL2waCQPYPPHbkGkmanavQ3ZvfCfIhBYgYY-1JNDq1mFUSTql6et6MKzVxHOjRNcpwczYleOSmD1R2ENc,Jenny Faith,Very difficult to register for covid vaccine.,3
gp:AOqpTOGsSegK5cLtkEiE7wKK5Iv-k8h7KAg_ckm6EuYrYfcGTfzLlDpQfR443kkmL3bHYAHqtSfsBWtt1yb8cVc,Neal Saito,Signed up through the WV DHHR. Did not receive any confirmation notice. No explanation as to what to expect. No way to log in as they do not appear as an organization.,1
gp:AOqpTOFGvY46RLJO9Tdj5ijKzEWsuZWVIzbKqZxfLWw4_mf_YSp7T70qLJyA15K8Hf7LtjcybwjEfQ9ZaBM7LzI,Bob Fitzsimmons,Very thin on info.. possibly worthless,1
gp:AOqpTOFMZ9MDzdk3mMmODZT-mE6R77oOeHYwKvG4m4eCY-4vwGjnDI3PpWWCt5MEyDyTNrhQvfUu3CJW5HHOB3s,Stacy Baker,"This app does not filter alerts according to your neighborhood, at least for where I live in the District of Columbia. After signing up, I started getting push notices and emails for robberies and utility works miles from my home. Not helpful. This is the second time in about 5 years that I have tried the app hoping to get neighborhood-specific public safety notices; once again I will uninstall it immediately.",2
gp:AOqpTOHIlbfuQPVyoozF4D7YFAUJ8bukIG13bgmnpGlgB7EMa5IOzZAbWI-kIOkU7GBsDAm1CrcXT-rMdc-j0g0,Janet Barone,It doesn't make sense.. very confusing,1
gp:AOqpTOFKLU3Oujfp-Jdw9FxEVy5FE5vbKGgljpFiCL0-vSoQW1Z2xHQ5kBtJcb-kKpXjgrpe1Qwv-QeULaOlIw0,Cliff Ting,This App does not support Google 3XL mobile phone,1
gp:AOqpTOH5LzrODjUqyW2qEf0l7WIlDDdY38MhL15pAVzR6xEbN4Axk5946mQmgjlziVUzJChNi8OoFSnXTi0RxFc,Michelle 433,"I cannot get the forgot username and forgot password to send me the links. And it won't let my husband have information because my phone number is linked to my name, I should be able to have two names on one phone number for making vaccine appointments. He is on teleconference on his phone and can't have it be involved with trying to get his appointment. and there should be information that the NRG site is using different guidelines than.... the bayou City events center guidelines.",3
gp:AOqpTOGO5tztVK3Ssr9Be4VBfdbXEDYW1QY0fRTehXD50BW46euozq_8hMcluK6e_EtpNyB0vqtMzoJPHnbjZY0,Tracy Elswick,Slow to open or didn't work.,1
gp:AOqpTOEvs_D_tLOMQ04OiRmggPXVEaF05BgKY7Z8Ijkke1sd85JBIlQc29cOSNzWoccWXeCyKZ7ctTBlCqOAA_g,Bob Smith,It works. Audible alarms are inconsistent.,3
gp:AOqpTOGOlOaV78fAaWLlIbxr6aySU-a0nacyXnqCfvgQtVfUV1J4DWhz3RmtZRviNjI4sc1WKqFw3F2LZzpxy80,Kathy Cassoday,Cannot enroll Problem with registration for COVID vaccine,1
gp:AOqpTOGeAGQpZiKdhWaYMiRB7r2yksG3nFPxxAOiqlYWBQ0qKZngviGHqY3F9k2rHudTd3pl3Wc_b-NJbuSW8AU,Jennifer Harlan,"I can't seem to figure out how to attach this app to my account, so it appears to be useless.",1
gp:AOqpTOFXjJ1x-CFkDLot4M7-pafk1At4zDXQnXpcD-TJT25ohQ2Q3-DyO7JkBS7J-wd9I98MtJ5tyiPgoH09g_w,Rick Sullivan,You need a college education to work that app,1
gp:AOqpTOEoK4xHL_xJvSR06nLNAj7hs0-pUX87HUfCRYl4Y-91zugWUTPaherR_TOQ1Bv0LwL4u9s_EBaC00qBi6A,Russell Bailey,Setup username and password. All accepted. Now can't get back in. Forgot password says username invalid! Tried registration again. Usename taken. Frustrating app.,1
gp:AOqpTOE6fzoiRvTl6NMlkTeveSU36fCvSkvPJOpDvQ5PFX7jDndKh6HeJk7E-fGRh09f7VAUpsahnXAnWctNz_o,Louise Mallette,Unable to get to work. Why is Sarasota County making registering so difficult for the vaccine?!,1
gp:AOqpTOHKXgu33FSfRAvedEIBPJWXeFWKsWyi6FvcHOX3tCseEAThgAOLVnSXFq8oDbdI7ERKKU5TbeiqeJkft08,Mary Novak,"This is a bunch of b.s., can't create an account! Don't bother to install",1
gp:AOqpTOEDe_uJ3mkt7L2nj0UOp3z2WT_0Rh8nzn8vAedLobLS0pEEcnEsOGf8tifqTSRluXVFiEJqJxIfbPIhOoo,jinoh son,Gives me a black blank screen when I open this app. Terrible app.,1
gp:AOqpTOE98RL76SJqZs43IhYPHeA8_DpoU7Yf9tMIQcZulfFM2cBy9H3xIRRt04mT7_fNlRRCtuBfarvQhf61jMU,Ekkehard Scheffler,App does not open at all on Android 10. I do not receive any notifications while I know I should have.,1
gp:AOqpTOF8p3LBQ-VSuDi2N1Fmvd-4lpUYwdB-4WCezAKBVZdOQZt7IAONYJfdujJHVlODNMdoEbMDLPYFPwr4rI8,Amit Nanavati,Not the easiest app to set up an account. But when you need a vaccine you put up with it. Don't try and start a business with this crew.,3
gp:AOqpTOF1bDfwwl71ZqFcqUoaygWleyE5jqQOQx2nHqrVpMjsQ-R_yHKjCGQ4unpzbYoretXpi3QGctIQNmbfIFc,Czarandom,the PDF viewer in this app is really quite terrible. It doesn't even allow you to rotate the screen so that you can actually read a whole sentence without scrolling left to right. They really could have done a lot better with this.,1
gp:AOqpTOFi8U3KLthdPxaXsE8mLhPh1gjUda-uWybTlQfCSEzxbJkP1i-Hclx5DVXTO86UXikCa00Mvk_1Is7YPs0,Nicholas Russell,"Utter rubbish app. Keeps logging out, for some reason my sound notification stopped and cant get it to work again...tried everything. The sooner my employer gets rid of it the better.",1
gp:AOqpTOEz3m8HQfWwiPkRi3fbiz9bWlvNOoUGN1j09gzP_N9d0UUu_Tm7-U0q0d7eVfebUI5L24DnC44RAQQ6Qw0,Ken LeBlanc,Useless (and the following is stupid),1
gp:AOqpTOHCwVZ_kKceEeFJUHcdj4wk0e3MODd0lXqDLqTqwCm2HHdtsuKNWOY4E2M_e5w4fFBtZFGqfM_iRvoq4ac,Lew Claycomb,"This app sucks. Will not let you login. I said need new password, used username, got it. Then won't let me login. Says UN wrong!!!",1
gp:AOqpTOFexCaKaLK1AQcCOo3r7LVhEwkNhwP4F7BK7uYTcH8cuJvoJLTGks7wpOkURNevRkAfXcfmiqVnf3o9-uw,Kevin Scott,"I seem to get notifications, atleast one of them anyhow. As reported in another review, when you attempt to open the app, the Title page opens, then goes to a black screen and stays there. Definitely needs to be repaired. No idea if I'm missing any important information because the app will not open properly.",1
gp:AOqpTOEOnjAAsXERjP2ltG9MevdybFA_j4bIAG0K78h4qypBQOVluax97eq5SoDJzDuSW-FEq45d68Cx93bpj84,Lisa *Masty911*,I get the notifications within the app but nothing on my phone. This is been going on since I subscribed a few years ago very frustrating.,1
gp:AOqpTOEds3Abo0rr4uZ_aFGJyBbVUymVvZtT_EfWYlE4cPOyKGrJyspG6Ep2YMJCd4G-QhWSAeBamEsJTdjtRPY,Ray Paulsen,Not getting notifactions!,5
gp:AOqpTOEmVZ_5KkG6MSjPeysCfWX7j5uefu2gtahB5AXNO7ZymAngqaX5i0PSh1HjxWpMUJq8MLdyYWMs3_bkH04,John Lynch,Hope to get timely notification of available Covid-19 vacine clinc.,5
gp:AOqpTOGevOIAwHM6hFTMWwVJrHIvQdaqTt8EEK66HR70_sZMKTgX0GvG8uMeganNqCXalgDv5opSZT9Wly6eqXQ,Mj Allen,Just awful. Did not recognize ANYTHING,1
gp:AOqpTOFs5bVyTzgq89HlRwGgIjpuwwt7z8sI23Bf8Ws9ozi025Nt9HKwvlFWrMCJ4ZN_n8oa3kcY84vZ-DV8Z7c,Terry Rosenbaum,"I have the app set to alert (not silent). I get the expected notification - brief popup, vibrates, shown in non-silent alert list, but NO sound alert (notifications volume is on full scale and sound on notifications works fine with all other apps). I've witnessed an alert notification coming in and definitely displays popup and vibrates but no sound. My county is ditching text alerts (which did sound upon arrival) in favor of this sub-standard apo. App on auto update and it updated 2 days ago.",2
gp:AOqpTOE4oMP8Ma8bxurV1No1ud2S5ncQVEnCUvPYferybDXmJze_vTyLC2kJr7w-gu_NMSCAYvqHWVars789XNk,Lenny L.,Justhorrible...,1
gp:AOqpTOFDyRuB-E3DS40hVs4EE2ovE-0s8Lzv4NUFSlGqJYd0pQh1fDT56pOb79g0Rykb2AfRQxlffzf6P8DnOWY,travis wilson,plus*,5
gp:AOqpTOGkVjbjNK3jyWUty4Opef3pMEf61bLvbjSHXYyKmGizNSZ0SqUwmgsQ0Th5Kmq2YnV5xL07F6Ws9oqSKbE,Steve D,It would be nice if you can set a preferred language to avoid getting summary notices in other languages,3
gp:AOqpTOHLl8jmrSFdOdP_W8zxOfTof42IlsxhTbpBZj2GZ34byWBQ0VZAAPYNvRf-YPq0icQ9BOnQLLoPMWEQE_8,Lee Comeau,Difficult and frustrating,2
gp:AOqpTOG1ZbwLuTQL_EWkNIWNxR255RK9nGwH3ZuKSI-OA_x8VrbXvmIXc09D1mJN8t6JITj2fuwXiOT5ahslnPc,A Google user,"Adding the app to my phone for the vaccine info was a pain.as far as birthdate was concerned. Had to scroll back 83 years, just let me enter the date instead of using the calendar.",3
gp:AOqpTOHYMR6jagRHGmuKIA66-si-Uz69axz6bNEsjuq0PlkZJbDHaZpLcskmY8bNPw21cmK8feVPufAV-JOrSGI,Belinda Murphy,This is an impossible app to navigate. Cannot seem to get logged in. Trying to get signed up for covid vaccine. I am 68 and my husband is 70.,1
gp:AOqpTOElazr-BIZPpj62KoHW301dLrwhpQ9IwyuonF6Y98LIyMM-i5Rs3hp5W7tEp31LkhzQ1GyDzDot0Myy8PA,Pat Ramph,Doesn't work,1
gp:AOqpTOFhWLT9XfVzC5aNs3PDGoBXHgmgPTSDdMzYYg6DEX704HjnO7wMYyG4yW3RHv0q80dM_Q-v5tw9YsSGkJY,Myron H greenspan,"The app tells me i cant register?? I dont know why. Friends tell me to get on your app, click register and register. The app response says I can't register? Please help me.",1
gp:AOqpTOHXDaRyDSsl2qbT_5etHYw0aN3jc4U5Fft3ZONPMKbUCaZG5kshzzYa0EGtz-BVMEdOnvVvUcxSZVxsSwM,mary rowland,Supposed to be able to get Allegheny County alerts. Not,1
gp:AOqpTOEuI_u67a4ZsHh_RUye4oZ2Ae1-0O1VkOARGwlwDXICZDWvdUUR2sVQdNucFEegreAa8eCJNIVmY05V-Rs,Lynne Nese,7 days trying to get an appointment 😩,1
gp:AOqpTOEZWgametuRedCtYGRLsL0lqtHV3KOVYyGH6wHhXY-DR3nRIyixLX0Pc1idKn7QFKDO7O0qK_uoBzBgioM,Pamela Seitz,Not good,1
gp:AOqpTOHkaeFosq41u863nety0U12pMvMC0KmRsBJJ-mJqDvE47ZprioGLSELYZ3rwOSIu41RlZVloUtUn3r9YXw,lisa jenkins,Has not updated since sept 2020,1
gp:AOqpTOEltPmhIp1XoH7LiCjUl70_Kt7JDgoOrXcnoNPP22lD3MiR4Z8ydFxc42wZ-4c0dk7hy2ZvsdUhf0MCz9w,Marcia Durland,Confusing,3
gp:AOqpTOEoxeKBzqQOawOT6C4b3o6KwzXloy-cCpqq-6nhvrb_eiM22g0USau8L9ivFx9FCVF46aP-4d1TVntqvo4,Dr. Bob Thomas PhD DD,"Installed correctly and subscribed as well. However; when opened, it does nothing!",1
gp:AOqpTOFkFHHKZPV_DbAaMuU5pp6aSyV6Emi7BR7pLGHumseS8p5jpiaZcIa75SGeUk86EPtqIaMncj6TXeqkjDs,Colleen,"Led to believe Everbridge was to notify me on The Allegheny County Health Dept.distributing of Covid 19 shots. What a hoax!! Nothing like adding more stress, providing false hope to us in 1A class. Waste of time is all this app does ! VERY Disappointed ☹️",1
gp:AOqpTOH725F-LSoSrfnq8GBU6YsI1IxfexBmmzcqQOZ4XjIigFZ5ZeUpm8K8bL1UGiPVcxDUDUPjG8_SiCH8nW0,David Moore,"Registration mobile number is impossible because text is sent to mobile used to register, cannot be read without leaving ever bridge app, which loses the enter number screen",1
gp:AOqpTOG8M4VNOg6jEMb26xgcSfv3BBdTNeEUOy7hTeH4PY0f6oh2je_vlbf0V4JcJgCwUlpkr9ywAd2ZkmpnS8M,Steve Grantham,Terrible,1
gp:AOqpTOFHJL5qHm0fxnJ4Nl8nPyYEKxxnUiGho5E5pJQ-024exG5VrnHcWt6Jb60XCiY4Dzxm_odlRN11-Vv1Xzc,al williamson,THE most frustrating....signing up for something as important as a vaccine shot shouldn't be as infuriating KISS,2
gp:AOqpTOEHCpW7E1sdHTmNpf9_gFUCRErH2QPV3BdhlWMPENBdHHLXZ5sejMV9Mhku5CGNUSvq2g1NaaaScMypqhU,Karen Klein,"No additional prompts available. This is a major flaw since Was the app that Sarasota County Florida has used to register for our Covid vaccines. No"" No ""ADDITIONAL INFORMATION "" prompt on my app. This contains all my pertinent information to my account and yet I can't find it. I have local, feed and events. Not user friendly at all.",1
gp:AOqpTOH5xaEXaJtI-7zHXQrjoXU8owmMui8K_8gwRftOkZQpSmXnjeKyVE9S1kgspFY_CD8IXk55tzcByEtUdJY,Louise Bill,"It shows that I have installed ever ridge correctly but I never receive any text messages from my 34292 Venice and/or Sarasota subscriptions. Also, there is no login or anything else. Please help.",1
gp:AOqpTOH-CgKmi1s-kHk8iN4KEjR4NOTn5LSp48RExmWdjviAkOk_5NnfoBiO7QsR_NTkH1vv7cJhnd0yzZ1li2A,Anne Armstrong,Local tv news recommended this. Cannot find either address or zip code to subscribe to What am I supposed to do with this thing?,1
gp:AOqpTOFxxwyTKeQypSICzgaDBg-o0NtT_l1veznbJgSB-w_GwCacS-BuD2oQaL9Fa0U4XoVYoce954XJfepBmXc,David Miskiewicz,"App used to work, now just freezes my phone. I use citizen now",2
gp:AOqpTOEp1B9tPN7GoFuH2gH-y_tb_hQQcm92d-DQsMOE0tKyklAyVqZt-oS0BtxGiVC8cZvhLNdE9VTE5CiEUmI,Dale Hutchinson,Difficult for me. Can't get back in to fix probl,1
gp:AOqpTOH24zlxCvF07DZy_Cp_XqL60HoIzdkF45ePt-9CFHqHiThzo6l-qlJ1X1KbhYG69WoHNrhbyWECumFUP5A,Deanna Sliger,Horrible!,1
