reviewId,userName,content,score
gp:AOqpTOHiPx9BoUF4jeOi76XrVtylb2qCSRsX_HAzBQ_Y36j7UMrcNKGZ95ZzPGkoW8RDagOART5f-JturWwDZwE,Flufficorn,Um... almost the entire state is on fire. Lots of people on social media are saying download this app to track emergency notices. I just made an account to follow my county for updates and when I went to my feed it was blank. I tried to add my county again but it wanted me to make an account again. Don't download this app if you stew looking for emergency notifications.,1
gp:AOqpTOF0GcFnCkGkadN1OGvwODEpiAK0yTb-qzItHVXS_n3eDITPbA19kQvi9ZwzK_xvhLvlQB5QMe3_9D3A2tM,Jordy Sanchez,"Good idea, if it works. Tried connecting to my counties notifications during an emergency but when i try logging in it just says ""account already exists"", of course it already exists, I'm trying to log in with it!",1
gp:AOqpTOG1CLPu_66M_ie0lYNII2mAlABHGo4OyMnN_tes7b6N1vfUM0DrG8VvdyUVx-XWhKhn5UlfjumODAtTDMs,Devin Manuel,"Service unavailable on signup, god forbid I need this service in an emergency...",1
gp:AOqpTOHu9vrLFoMvLU-eb9AT2soNijp1HU1hEIradOCY9mGNUHKUmJ3loK0iExsHQHuK8FWxX1_05IiNyhNpxH8,Chris Sobey,Wouldn't let me 'enroll without giving it my organization??? I don't have one.,1
gp:AOqpTOG_us7kBlUxkkRKmQDKZsr0-J3_bysCbmIxOfDctYRpDnCuAnIi58Ou7WJdAccQk195T4bejjIcgX8IfcU,Mike Meagher,Worked well a couple years ago during a wildfire but I haven't been able to open it lately because it crashes as soon as I try to start it. I forgot about that issue until this current round of fires we are dealing with. App and OS are up to date. I appear to receive email alerts but nothing from the app. Very disappointing because this is what public safety wants us to use.,1
gp:AOqpTOHR4OVPuSmXpYuuvAqSCLjZbx-rB_vkbwWaX3kKApPHqt4RLoZIdHcuTR2sk68JxKkX8EEaQdEE9C9M1AU,Sharon Destefano,Impossible to use,1
gp:AOqpTOEnNKnaBU49qB0kBR31fsYf71t2CSxO4Je-AxmuDf40xMkR5Rgiqom9LEmkrRhza7CNmuJS5b2OgMEn0kc,Jenniffer Petty,"This app is absolutely horrible. It found my subscription to the county alert system, but when I tried to link texts and notifications it will say that it linked with a text, but the app shows that it couldn't find the subscription. I downloaded it for wildfires near me, but I doubt it would send me anything. Don't rely on this app at all.",1
gp:AOqpTOFHp4fV4XzxAlK4881JWgtp0wXQbmgIW0DayW_oSG5qEqp52FfeiNKw-qM2K8qLIJHplSD6hFMUDZJ9L6A,Ruthy Ramsby,Totally user unfriendly. Could not access my user profile or customer service,1
gp:AOqpTOGLpppcCRRnogWo9VhyKWiVBD5VQsZ069GU1GRNib8gZLlw30n69iCyD1juqMHJ8w5aJk1_fwpwX7Xawmk,Sarah Alaniz,Isn't working in any capacity,1
gp:AOqpTOG3XSCZ7aUNQjB4drXGj8y0FrIcwQgwYJhvMe_0eWe_wLI1tA-akBiQs5lxkU4djawCOUlGSq0JfHvcc9I,melinda holberton,Dumb app! it is not user friendly couldn't figure out how to sign in or set up.,1
gp:AOqpTOGRUlaYwv6SUPIejXmvsbyiJiXfSUnjG55FFPqszBDcT_TpYDyG1NkWWuYCiECNC3-wv7qrp58S1WxukRs,Grant Clark,Absolutely useless!!! Zero stars.......,1
gp:AOqpTOEfFyARJUQboejqMJspq8uzUBnJ5BKwtD1pGJ-pSAmF5omi3ihVtTQhSwMtHbM7hUdw3yH46cOqTn-7KIM,Sindee Remenih,Terrible won't let me enter info,1
gp:AOqpTOH-oLUYijzP1BGUa9dQ_3nOJdabaCpH2Nf1xmCxMXX-jXgQH_eUwqo7SbX9Mc4N9riMYqx7jBGN_nSGqWU,Liz McCrary,"Half of the county I live in is currently under a Level 3 evacuation order to ""GO NOW!"" Everbridge app continues to close each time I try to open it. I updated it. Same thing. ""Oh, nevermind. My house just burned down."" More people will be signing up for alerts! Create a larger bandwidth, whatever needs to be done, or get your app off the Clackamas County, OR website as their ""go-to"" emergency app! It's rather worthless at this point!",1
gp:AOqpTOGptNNB-DACpqg7lNscp_O-ic_3HdR97SY5ZkLzvYMnbYqqoo873VPXlvxjN3avQGBCsdIhO3qsmInqMjg,Suzanne Webber,To hard to set up,1
gp:AOqpTOH1IBWYtehr7FnVof8EgF01UeUsEVg45daCMQjkdSyHKNL6hIhmeT6GYqEsewY6ntjIVy5vmEUgTbOHo-g,Christine Saling,I can't get information about a home I have in another location. In Oregon. There are fires all around my family members up there No evacuation order there in level two. But we don't have access to a roadway out. This app won't let me locate that information as I am not at that location. I'm in California and the property is in Shady Cove Oregon,1
gp:AOqpTOGVD-J5-CKhvjNuDwlXdkbZHExgPn2pbN74CNTMD32rIfbWIKGfS8pKYgy4L_aaZHvuvwb8z1T_Xv0kOYY,Alexandria Cummings,"App doesn't work. Every time I attempt to open it the app give an error of ""app keeps stopping"" and then closes out. I got the same problem after a fresh install as well.",1
gp:AOqpTOF3NcDtij5brqNh5oUWl_qUA7ZNt0SGnq5eJ9yn6HbQxJBoah2uG2nRwNhuF9q3lwC1P94SyCehd4s3M9g,Anne Bishop,Diffucult to register.,1
gp:AOqpTOGDHgKU8E7LkLZ1RkKoghyRD9PgCZN5X5FllL2DpoLehGqJOnpn1lfwPVuEMnmspPL6gfl30rNoz3XPJ5o,Megan Wilkins,Not acurate,1
gp:AOqpTOFF95gjmqpPgjimwdj7_-5LzGrrw7p_zhNEmi5K7qj6bPDqTUDQdudg1swezFeuu4xIyDNPwXStePLi4p4,William Bell,Crashes on open with Galaxy S10+ and Note S20 Ultra,1
gp:AOqpTOHl9qdnaSmYWnUe-QNHyWmkhO4U-2OmJJTSTaCzRInFmo8dTw9Kkmam3yRi3xzXhriKIZxNvX53ACPFvtY,Tim Surber,Says my zip code doesn't work even though our sheriff says to use this.,1
gp:AOqpTOHbtuRoG6dgD5qKG0vyc50JUN6vgYw4KEKGLCaJ24suQqRhMlRcmGyjNqI9CQ0hdVDh2woHaRHjHJDVd40,Patrick Bryan,"Very good device, make accessibility easy",3
gp:AOqpTOGmZvp8ZpT0H83epuPu_quHaXeOS-d9gtst4x94DBEtZT-SmTfigVu-BlrDEOUKF_BPLt-jhLlxFTAobeQ,A Google user,Smh,1
gp:AOqpTOEJD0L-X5rUoBuDP0Z6nG1jnAYWNftGaASkPr4EEpp6v61J19cRjj0_dK9Iz28u59HH9vZASEHngyzuZfw,Joseph Trivelli,Don't find your location .,1
gp:AOqpTOH01iy67qK60lmw8Nf5bvTwId2y-c2xu3rBc_TKokc65tccl3Vb5tA4fFArSA7UJ0kezuw3hWjGh2MH54Q,Devon Tomlin,It doesn't find my GPS when I'm in the house. It doesn't say I'm out of range or if I'm in range. It just gives me the yellow on my clock out time. It worked fine until the update today,5
gp:AOqpTOEnJP3PUGp59Nw8l-LGYBT62t76yWXLz-X_NLnSA-6BILhMfLaTYmixV4iUN4ZhNhAdtUAICX-oFsysVZY,Denise Purcell,Horrible app..reinstalled several times on my android phone...same problem. Cant answer question number 4 on the health checker app because the screen freezes and wont allow me to go further to choose an answer. Required to use this app for work for entrance onto a cuny campus but the app doesn't work!,1
gp:AOqpTOH_M0wkndy47EtLvBIX4KnauwjpWZRhqh0Rlg3sy-71mTRRmeNGuIFa6yhC39JzOqDJ0LeVI2AiViPAB2Y,सुरेन्द्र सिंह आलणोत,Just download,5
gp:AOqpTOGj4nLyKzbxhzgw-oEdF6qGV8MPNX5BM1DJTLyoVOKw4b8UCdrC6CQvNKC5vloF9nvSQ2Z_IEe5oyFqGKY,LaVerne Cordes,"Downloaded the app, as instructed by my institution and authenticated the log-in only to be given an ""invalid account"" notice.",1
gp:AOqpTOEO6zb99Jk7It-SqH_uEU0BSC26TobRen92RpIxVvs9E1iMXfJpY5HwsX1KNO82vrSSy-yDLLmDmFJyiL4,Alysses Mae Pimentel Monton,"Not easy to register. Takes a lot of time to download. If this wasn't a required app of the company I am working in, I won't waste time redownloading the app. So hassle and adds a lot of stress.",1
gp:AOqpTOGU4oDrQACoAPsgCvguPfuQWrdey8obph6kLAEjKvcUOQrPu0F86d_oxtlUksI0LUrbyQ9JQ2QbzGTdpQQ,Robert Russo,Reviews say it all. It doesn't work. Big fat wot. Waste of time.,1
gp:AOqpTOHZ3sDHv6S5ZiszAT8OxNIJlUynAfSllX1Bc8Q2pJtPUntwqkknbpvmJ3HAr3weNyZCkcnodrx06RrB0GM,J. Gomes,"I can't sign up because it won't let me paste my secure autogenerated password in the ""Verify"" box (and I'm not about to type the 64 characters). Please fix!",2
gp:AOqpTOG60hM_1uV9uDMe-kP4rs62-7AsCA4YDET1L1Q72soE5cqzAGivwyO5iQCZClLERDmifUFq-O69YBndlQ4,Stella Baker,Total BS. I'm in Sonoma county close to uncontained 🔥 fire and have received exactly ZERO warning from useless NIXLE. Burned out by Tubbs in the middle of the night. Do not trust this worthless app!!!,1
gp:AOqpTOHFitzv0iYp69PHAuZ3eew6i8ZFssiEi869Jot4b0Y75CKtNYGTZ4QdkEPyjKsAVDjvGA53e0gygvKG2tg,Jim Reece,Constant crashing. Totally useless app.,1
gp:AOqpTOFlAobKCZC_P_ybIlpXaDaLgDMVfpXLqPDcq7BrNZIxPcmXn3oMzuj3iZ_SuvKCRNDu7tUNFsT5sFVBq8o,Heather D,"My husband got public safety alerts, but I didn't even though our locations are the same. I can't see past activity from my police department",1
gp:AOqpTOFepcZjxnJGejbAcgegt0QIC-qwGuA5JYLzr_G5m6UHKGOCmjJC9RAEa0KZD-lAS7Om4m4fjSRZniiV4f0,Tracy Grover,"Tried to log in after verification code. Says I'm not signed up, but I am. Useless.",2
gp:AOqpTOGumzBk_fN68nSRyFJxD077G7iGLMVZE-M-CBad8FYChiyCA-lrrQyOIM-zoe2xn0M_OdpLBx_fm0zZgkU,Catherine Mills,"I installed, got some incomprehensible requests for info. Got asked about finding a subscription, but no info on why or what. Uninstalled, and good riddance.",1
gp:AOqpTOGxsZMiqhu-uHU76M0ZlZCFlvuAjCB8t9kq12xgrDI3D8Kvan-eetOgShIxQuBzxMfJm874sNjbu_8H-tE,Carol Robinette,Good app to have for Emg. in our city areas. Thanks teams,5
gp:AOqpTOESmYeM8IK7N7xQHjQGexX4EMRCL3Z-pKpCxEBDAdyqZwOJIpdgk2D7tu0GL7Nr9dHfYK2J-FILNrAKA-M,B T,Spyware,1
gp:AOqpTOHENQ_DUcstXbz05P7id57ZfBkh1u9758OjQEU31-gzcMBlpFwaXpU-pmJ6DPfBonSNjtGtEP7-KI3eLng,Wendy Benedict,I get the notices but I cannot scroll through a lengthy message.,3
gp:AOqpTOFG1a6Cky7zE3OU4aCZfJcYKwwOG4wcZ_XyL2bnFVk2qhTik4_CUwxjZUp4z7oi4Xngiu6pLy7G4G_M7QY,R Y,Being forced to download this app. Hate it.,1
gp:AOqpTOF17CDJKZ8zvuCW8NseW6OidZ5kKDfS0KVCPYQ21yH8ohIdOg2BJKWASylo_DjDk6xP2IhXuYdyCNQ2d1U,Annie Stratton,"Appreciate timely & accurate warnings. Very useful. Lots of control over kinds of notifications, locations, quiet times, etc. Early app was challenging to set up, but I find it easy now. App is great idea when you live in a place like VT.",5
gp:AOqpTOG014zZ99T_jm_ioZ26uzGrJCC13p9K1BGHG-M-Bq_fJGl8Yj4ZNvU5AlAFa9g15sShRbXrJqATxYc2Xjc,Joe Del Rocco,"Garbage. I was directed to download the app. I downloaded it without a problem. Opened it up, found my organization, logged in with my credentials, It got past login screen and sent me a notification to approve, which I did, And then it sent me to a dark screen that said ""Invalid Account."" I tried multiple ways of authentication, all resulted in the same :( What the hell is the point of this, If it recognizes a login through an official account but sends you to an invalid account page..",2
gp:AOqpTOEVlK6cL7GkbjEBtEoFpo49eB-xzVF7IaIV3o81wmggjH6EnQzFpe6fD5IcXnBcg2huBomiyNYAHzbOh6w,Art,"I have no idea what this, app does other than display a local map",1
gp:AOqpTOFT26ajL5RtQZWBsTOMbbCVHO-4nM25_oZR24NtaPTKvcB3zphIkYUwXFg90nRedRWrGvBUjgHZq4I3eA4,William Kim,"Doesn't recognize my credentials. I literally just signed up moments ago, so everything is correct",1
gp:AOqpTOEg2IuQjhDxpBMsWgCHvcE2KKaEiJ8m97Ot3q9Fts2gCrRJRAhkiUSszBWGmJyavMG_Iu8rEn1uA4odsvk,Ku Mag,only installed this because we were told to.,1
gp:AOqpTOE1WXtYLkmKuURhpMZHwNCS4vG7ZqpE1Gnvl74kSJ1tzfHd07yQAln2tLYhdc7h1WHeebeu3-l32WKY6Wc,Jatinder Jaswal,Thankyou,5
gp:AOqpTOHw8ET0bq9tO9yQYoEQ6vZ0gGGu3OfErzHSoWDkKo7RxCjdssCsvEUhSrd3kdCJAW9zscEppLB94jQJHaI,",Terri Carpenter",Cannot sign up,1
gp:AOqpTOGVwsn0BTHfl3PfmH3n7nsXz_Vp3EmvCEeg7oSeB3hwOYoB0i0KLuXXe9qNXkDEM-Snti10scQBNHF3tSo,Eliana Martin,The app never opens. Useless when it could be so helpful.,1
gp:AOqpTOERs5Zr3v78dYfhGHCTv5KATyLI7VzVcoO1Vtai6JGtHErucaT6EyglIpty49BYmYa9Qw4nN4xp2Y6p1KI,Forgotten Ink,"Stopped working completely some time ago, get no notifications or alerts anymore at all, been months, plenty of issues not be noticed since this app is garbage now.",1
gp:AOqpTOElJ0GmVjvpYo4lPp4LMMm4mOrtCdczKhLhd3Y7RIUn7j4m_DUINA2U0os8IP-SN9Tba11RG6Qa_dVJ988,Sumer Zook,IT NEVER WORKS,1
gp:AOqpTOFmy_EQPWRz9BXuTWC4Nj_J4BuKbncOUOHMZigKm-AmbCQBUeWB7z6jCO8zHx6a8o53mNA0h1gVF0gBjms,Michael Anderl,Works amazing!,5
gp:AOqpTOFdtobormi-QTPvCcFiSKvQ4LnC24JHFV67uCeOarOqh4pxW0PU6VnwsuDHTZb2y6sFaW0Wfue-NkqHIH4,Wayne Myers,"No emergency subscriptions in my state nor the surrounding states. So, useless.",2
gp:AOqpTOFh-aUalOW1U40D1i6aH-uyr2-ug5P5WOg84shdhBKR9cKVI-ZdNDik9674FVOLOc_hhItZ_juQR7sG2ps,Sandi Feeser,Trying to sign up and won't take my code it sends me,1
gp:AOqpTOF_pCim0THoVClcMeKS7hYGfVxFRbtifkjgPjmybOqJsg3PsnZzM1xLvHCNywmfby5m403Q3qKSGFg6Hnc,Gwendolyn Gibson,Keeps the public informed about police activity in the areas they live and work so that certain events are less intrusive in their lives.,5
gp:AOqpTOHOyMxA81M_x-pvMQdO09Nl4-OdN_Ra2_dEUpuzX2bAd3x8rOiel2Vq7xaNNXcq8EngBXXNtiSrnMEhDps,Anto Adhiatma,"Application always crash, can't be used",1
gp:AOqpTOEDmYK2IY1-S2Odli9vckITuglbBnRLlwLuLhezBnHgqFp1gjYjlHiTqkeCZivxr5wtxfkYj5-7i9qhbxk,Marappa Komaregowda,Good service,5
gp:AOqpTOF3VArntHvbzDmamx26od1eVZTPubxDnouPT6Fq83NQ9WGvgcQ3K4RwVaQ5VUFomzNmD3JW99w4ae_UR0c,Vincent Menezes,Good,5
gp:AOqpTOEZ_rRW3OJmZeOnSlD9sA670MuFnBZ3fsDjkI1gChMzcm2NyiOzbzgRdSmaI4NvbDsGi0DX54kfWS11YOs,V,So farso good,5
gp:AOqpTOGEyA9Df0dABYytq6qIxSajBNx_QIKitneWWFQJ49VOxTWUU5JdUEnSUs-ZIrX7LLcZvZAhWaUJJlDURKg,Elaine Kaler rash,Live to know when there is a problem with puplic transportation,4
gp:AOqpTOEA_xU1NcP7G09Tf02a6H0Ms4qLjtP37hIo_pM_UbBp2AjxQlfYi64afhoOZcbg8wQ699HhasyFylYmfN0,Pat Larson,Reliable,5
gp:AOqpTOHuob4slDO1XJOD-ERWemcjRV-zHlP9DjB0X2Q9VJlb3GZ5dNCXhiUlb15R8LKlxw80ZVtl2K-cFES2yi8,Monica Respass,Makes my updates from the state clear and concise,4
gp:AOqpTOHVwpgY-LVXCNxvTV3MqKMAX3HPLVf8wqQ0p184FS2E-Zz90_xpIBeRss_UUJ6ef7GXJtyMLvB_G9Wu8ps,Gin Kish,App won't open. I am required to use this system for work. I have updated the app today and it still will not open. I also get random messages on my phone stating the app has stopped working and needs to close when it isn't open. I can overlook the very un-user friendliness if the app but this is ridiculous.,1
gp:AOqpTOHG7JmGYoMnl9jNZ5RNS3Nk0JmLU-YiBj4UdH-Pet6VNHdKgDLZ3IDOowlYcWILX2uvqY2lhTmF-sMaOCU,Vicki Schwartz,My app always shows messages when I have read and deleted them. I cant tell what's new and have trouble scrolling through.,2
gp:AOqpTOHQcqYeF21edT3dFYN2VjXHhp7f866NoT_YBa-bMA35PeXpzvysbnMJQtGOZEvUAmxvP4EWf_CREATmcMQ,Edwin,Not very user friendly to set up and manage,2
gp:AOqpTOGmoXrmI5uO0tU1-GxoEDBN9qEkqOMpNAyTf907seh9L6YJ9OaH_HUgHL9333u-ihzC34gJi821WSbyzUI,Betsy Echevarria,Haven't used it much but it is available to get updates.,3
gp:AOqpTOETojKV5T0YLOIdrWKA5zxPo3RwTbU2eTbm6YES9IjQyhjVI-8P_qoASc323tQeHLo4Cc8x3Pc0va6VPjE,ASHOKA LAHA,Hjjki,5
gp:AOqpTOFzeoOD50tpHIIjO3jvziItYDnWv0qupGeh0DEW-1pykQmIG5nIf1L2ntDRh7QqObQBd1hzYTGMh1e4KCo,Mark Krueger,Alerts disappear before they can be rrad Difficult to sign up. Then early this morning my phone vibrated with an alert notification. However clicking on it caused the notification to go away and no details where kept in the notification area or the app. The feed shows blank as does the local map view,1
gp:AOqpTOGquOE-4GjNFFWCZBCkzqnhaWR3F0jSaj9DMXi3FdKarInyHxnmEUhRy4Efk3DiQQE8HGC32XGlaxb5SfM,Gail Hoffman,Can't believe they changed from an easy code red to something like this that I can't get to work,1
gp:AOqpTOFf3f7DS9rp6s4YW4FHta9I5cQ1DJ293lXm3FxzCIkzVkUZIvb8gMW0NVTmlmmeLLzkeT3i-XLmmmfCszY,Donna Mariquina,Very useful,5
gp:AOqpTOEWOC5vfj8XyACgcitGXtoWsaSAXId8iVGJEqRnXdBp45zUCW21hfqil3LmnEbd9XUYNf-EjCiqy2JNhuc,Ginny Clements,Couldn't even get it to download. It sucks.,1
gp:AOqpTOHlHEB50I7ooGdX6irMaKDn9GU91ZI58otqgUJVnKZN_8qjC5x_YzQ4N8LoOxqr6UXPtnqRvXOQtp7VjtM,Robin Bell,Been using this app for years,5
gp:AOqpTOE7b2pPEwd7xdOLWC5B5zPdfo7FlV97qGXftyniitH01QX0eF178zWYigboqlnNBIhBz1PRhbUAlRuuTyI,Steven Moulden,"Alerts not being pushed from Alert Lake. Signed up as required, mobile notifications aren't working not through Nixle. Will go back to just sms alerts as this app is useless.",1
gp:AOqpTOGVEl8QSBKl59KhnQP5UiSgte15bZDACIQlED0pAFtIvLkO-z7dSDie2kBt3i4ZO6BJYSlssNn-eCgYHZE,Jennifer Slusher,"There are still some things to work out. If you click on the weather attachments, you get a black screen with the letters in gray squares, like a ransom note someone cut out of a newspaper.",4
gp:AOqpTOHZgaP_Gexnj5uBWqXDHMcttIqkEL8ZtZQBE9PQuJG70LICoXr9OaogwqzWbCKWAw6UQmGehsJaQW7ttco,Nathan Matharu,Registered and then the app opened a bunch of menus and crashed Now when I open the login screen it crashes,1
gp:AOqpTOGdavDfJTjl1YAxmsqH7rJam5yP58K0kgNzpL52k53AO_wDN7dqIY6IqoXGc1BZ-6icC4B6zQZY0bRmUkU,jordan encarnacion,Always kept on reminding the office compliance and data privacy!!! I KNOW THAT THIS APP KEEPS ON SAYING OVER AND OVER AGAIN LIKE A BROKEN RECORD AND THIS APP IS USELESS FOR ME.,2
gp:AOqpTOEaBHXuLV5srJItFkkkC9SrHGDHy34MaHvuzwaKJQSy0uUhvrxr9Qg0yMSAodcy3dHY86DwKeKXXra052g,Pat Milone,Do not know if I am signed up or not. Never asked for phone numbers. ??😣??,1
gp:AOqpTOGBt56gzbLDghAjx8pok4FLkyBOzzNnbKekXw3UFFnDPMQexvCwjzgqE2K8rM1Nm5c0IL_VprkF2nJV6zs,Crystal Pasillas,Blank .. that's all on my screen! I can see anything. This is not an easy app to just look at. I see white screen everywhere I try to tap.,1
gp:AOqpTOHkyiNjTW09MSL3JuHG6MZfYBW9aREOauYRaSbGfZO5Dv0qOVHZqSvffyuTHyHj1u1Znl9II6vH0Wu5c38,Merlin Watt,"Useless. What a waste of effort to install this only to have a critical update about a local incident and read it on Facebook. An hour later, still no notification. Don't waste your time or give this app any personal information.",1
gp:AOqpTOHkmN8mbwbQMoPPdUqDAYsQ3bxdPU6ePmhgAdSQIhHf3EFpceRylaOt1d3D0pJm0P77x0Bl2jIQiP6LkUQ,Kunal Patil,Get easy notifications and updates,5
gp:AOqpTOGyYVu01LDtQWCFH9RPeorUbD8NN4Er7ufB2KaUvjsrMyZ9yn7CqFsydKAm5NItb9xUnSDEXQ9hf-NqdZo,Lori Knapp,Everything about Everbridge sucks. The worst app to use or rely on. All gov't should go to Swift 911. Works great on the receiver end.,1
gp:AOqpTOG0UJu4KZlXtl8dMuohBZoETrfjUjsciBrZV3hS-e-TolfjJ5EN0hqaDnjn4gGRNofI43VRgCy6qbvhT9k,Amy Binette,Verification code doesn't work. Tried twice.,1
gp:AOqpTOGGcsLH_vEMdI4XzZtdQNj3DsbNd8ipY05gh44I2ZvWHAASRTOke9Nmc4nmeQ-Rrb1P5_TYrg52BBDo3YY,Ray Kuryla,Everbridge has been instrumental in bringing me alerts for the San Francisco Department of Emergency Management!,5
gp:AOqpTOG4ANzcMvNgNHlVlujxiPWB0BSsjknijBvwIPodlP7jJlwlfR3wlMLHTRPx3HbeQjMgqD8DxIOEWxEq-ko,JJC,Horrible app. Login is sketchy and when you can get logged in the app frequently crashes when trying to open a message. iOS is hot garbage as well.,1
gp:AOqpTOGonSSq0gYnJdOjSequC_0UNy9uiaotnPApkwj-R5x2Ybw4m80XVfXt5oZC0vtXxT2YHd-nh2wv-mNU5No,Steven Griffith,"Just quit working, tried to log in, would not accept four digit code you sent.",1
gp:AOqpTOFnaM1n_GFgWfyoonsUNScmrv2OL4rcMmjnS8FNQWGu09cdB6PAc9Z-YqY1tGdYWvi9zGFIb3hIR9jAi2s,D Web,Does not work. Uninstalled and reinstalled numerous times. Used by my company. Will report to my company tech support.,1
gp:AOqpTOFsOI3a9ihRfa9Vekp1FDf2bk79YyaA-e-y9grVhVjQxcJa3L7ia-SSucHd6a9GzzKity45cE9tZXxrZSc,Madeleine McJones,"They are not accessible they scare people who use screen readers with the he word threat but no real content, they use the duplicate link ""here"" this app is like in the 90s trying to seed fear with no content. Readable. REPLY Accessibility and software for the the millions who have various disability issues is well defined and documented and federal law int he USA not to discriminate, try bringing in a person with a visual impairment to try your application or meeting basic wcag metrics - here is not a link here here here here that is all they will HEAR. Google WCAG your links need descriptive titles - if you use threat you better explain the threat so that blind and or visually impaired users can understand it.",1
gp:AOqpTOFaQRIYawS5dIFntOKG2goOBRRD44k-dlOMKgkDj3WpujnkAOYnbLj_JmSJwzUn5SGhPEj3jLLUvCyOVLY,Antonella Priscilla Caputo,nice,5
gp:AOqpTOFWHZ48uvVmQAXgMKwfpcqyA6P0K-DvfvD7pSepRlcAghP3TNMYmycz0g5oQQFMT5wn6hr4QsB_9ZGQctM,rhonda dorsey,Does not work!!!!,1
gp:AOqpTOHyJu-TAaBgIW9XbnMsDDR1co0pab9rcJv2og-uX0-NVx2l_9XQovwMSg3Veb_qgMMONG3nI-PZWB0-W7s,Prajyot Hanchanale,"First log in attempt successful, from second time it's saying Invalid Account.",1
gp:AOqpTOEbq6uKl0O2DIzLs97MR00BJnP1I46UCf2uqCtISxw0doWcN7bltT3RATC3ZkNg5d2tD9DE_BmNfFjxQDQ,Moj Buffe,"This app is so stressful. it keep crashing right after i downloaded and install it and, since this app is nedeed in my work, i really don't know what to do.",1
gp:AOqpTOEtOuez6JdQ1a0B-3rKVzjx-tPtu_uoblsEITaRb_h070jwe8hJGdHwrUufrnNYHU32mRjafNKQyczNXY4,C Johnson,The app is still crashing on all my Android devices after installing v9.4.2. 4/14 - Still not fixed with v9.4.5. Tried uninstalling/reinstalling on one device and it can't authenticate my portal id.,1
gp:AOqpTOFrHMii6fa8EhZ8sZ0bcsMLAo-DAWn10BrbHhI_U-IMKFaLD6WHlqQKAfZSj2epeBnuyhayvnnUAMg_Fcs,Shrikant Potdar,unable to find organization.,1
gp:AOqpTOHsjb4t6lZCxWey5BmmPM5UrazLVBTqXgUhVz-vVMkcQl16y1NMbKPSlNqmY_vC1dxL0XXoxMUfj-z-ZeM,Akshay aka Alchemist,Absolute piece of Junk. An email on outlook pops up faster than an emergency notification on this app.,1
gp:AOqpTOF9yQb_ft4rfQQvkeagD4bgBgG53XVyCx0nGgEuwyyv3Ra9qnMEGkvC_EVGO4hLCnQavXk2tFDJps6XlF8,Aaron Bertrand,"This app is a mess and cannot be relied on for public safety and health alerts. Since that failure happens on the very thing the app was written for, it's better to find another app. This app (April 10, 2020) fails to authenticate correctly, even to the point that a correctly-entered SMS verification is rejected. When attempting to add subscriptions for notifications, login fails as though I were signing up, and signing up fails as though I'd used the wrong password.",1
gp:AOqpTOFM6BAE1-AmPnW7urIIuAhXZliZncU4BW3_WwDU5ifyeviw5eLGS_YMqvIy14dnn54uYlvi3_1q1nZyoYI,M Ray,Nothing but crashes since early March. On three must recent version and no change.,1
gp:AOqpTOFpoHYrfbEn5pHzVC_ZCGwkyFJaxAvuD9YvSCCSQjYm8dkT3WQtbcvd_QX9CSd22jIBXr0h3i6zbC0XSwg,ashley marie,Can't even download it,1
gp:AOqpTOFf-h1AVh4imeMU1af_HQDuUxGIaMGLwnZIL_uxSO30DrDgkgnVZJhBuixby8R5KYSH_riPYDoFlNvhaV4,Linz Marie,Wont let me sign up for nixle reports with my number. I got the verification code texted to me multiple times and every time i put the 4 numbers in it says its the wrong numbers. I put it in correctly something is wrong with ur app. Very disappointed.,1
gp:AOqpTOH9O3SbRo05tc0TYWqi1o0mpRm96pAFeOQLH-eWFn6TA4Bjf6zP3XvENXRKZGoe2J0y3f8Ydb8KDCEnaSE,Victor Brodt,"Unclear app, bad layout, and information not so useful besides that they get 1.5 stars for nice logo....",2
gp:AOqpTOHV4h3V4D9PLnfi3_ynbbxiwHH2ZZXTmiuEWenLILg-A6vxlfw5iSxV75Hr8xakXBx0Rt1X5Ga6u_KAYHM,A Google user,"Horrible. Cannot find sign up, cant connect my ny eas alerts, doesnt take my ny login. Worthless app. Dont waste your time downloading.",1
gp:AOqpTOER866HQmIK1ZZyAZD83uOtKy4745LJ2L9Pg5FUTb_LYq09uqHHxEInMaz0YcYwSya01U94-i0E63wFJsU,Amy Frushour,Emailed them over a week ago about my app crashing. It has not worked in about two weeks. It tells me that the app crashed and will not open anything. Please help.- update- they were extremely patient and walked me through uninstalling and reinstalling the app and making sure everything was correct before ending the call. Thanks for all your help Bobby!,5
gp:AOqpTOEdCU4oa2Mei5uy5ZvaucBav6Tu829tMly0MNRyMNiyDGCXWlLZ0KgB7YQ2EanmtoVDrVzjTggCw2K6Lp4,andre wilson,recently updated my app and now it crashes and will not open!,3
gp:AOqpTOE8JtQc63TyyhXdYN6jJgPBKMLM62WSUfsroysnpn93BMPJ3AT9DIGXeCpH94X-lHkG33pZbyLSveEJ658,Linda Hillyer,Causing problems with other apps,3
gp:AOqpTOG2wfsBwxZLD_Xn-r9wvz1A3Wa5K_CXDtlo0vXB87Yn_7969WH4u50OsUPvASoRGSgnES53S8UQOzIXWao,Anjella Castro,Ok,1
gp:AOqpTOELC5he8WWM2aL0NP4qPQDBI7t_VOcaOmV14l910okgF_4j0Q95ERi-c7jYd4qSLXghBSBKLTa5X-1xE8Q,A Google user,"Around 2 weeks ago, the week of 3/9/2020, when I tried to open Everbridge it kept crashing. It crashed throughout the day too. I sent a feedback report once. The app was updated around 3/23/2020. It still crashes when I try to open it and at other times throughout the day.",1
gp:AOqpTOHPWTNBqT8pdlEFhb70EUFSMCHBwf7KsrpV9CuyBOXN1iqsulJzY2QqsBi1-rCwo1_ZX7PWuNo6QhXV_Tc,Amy and Jase,Kept saying verification code was incorrect. Had to uninstall because I couldn't get past that part.,1
gp:AOqpTOEzwXJXn7lWLb5ubmACgsfGQH-G-LiH3SbRuNq8UzOgQb8jnXLEtWSRIaN6R7D3p5b9OeJrS0sGhJSpSHA,Spooky Treez,Doesnt even go to my area with exact zip code .. wont open ...just a horrible app I'm surprised my kids school sent a link for this. With these many issues I'm gonna just uninstall amd find something workable,1
gp:AOqpTOF42wTHNU5DrNP3HUlsz84PywyJJx6XaYUgrmu6gOQqtoonWboyC9Btm1GjB5KGUC5HRGzbmTCSHWMGHi4,evelyn talavera,It's taking a very very long time to download.,1
gp:AOqpTOE2eVCWARdmnRYsTWnACZkYfMGsg1Y_I_RFKBZPpjD0GB0-RJQ5E7PTBkniXDf0FQFZAiUQN2X6IS5_EQs,Tim Enright,This app won't even download. Waste of time.,1
gp:AOqpTOHq_0AUG8r6VQrJDBOqLBwIW4Wo5gLn158_EuEut-qKoAd_IApm7QKRJA3BI66YQIFAsTtRaYIAjf5Vxxc,Seth,This is the absolute worst public safety app ever. I would give it a minus 1 if I could. It cant seem to find any of oir local govt agencies?? Do yourself a favor and DO NOT rely on this.,1
gp:AOqpTOGLEKQfnjRm80awqELh9u39S5CJ4sutCnwBj6FILttsi3GhoAXMUZW0Ja0KAk_peENpwXNYcFcm92yBrSw,Robert Borochoff,The latest update (3/17/20) does not work. It stops running right after it starts.,1
gp:AOqpTOE0CA3T_RO7JsaUuzed_7n-JlFbC0euTUFoyUPaz79tpbmPKrACzemPan8Y8GoTomvuF6iv7oXGtpvuGxY,Gail Harris,Updated latest version,5
gp:AOqpTOHI1U9uIAoFfi5DaUURMIzsqqgFfzv1q2X8Eb0tRuY3pSceitFPmt6W_KZSZ_zSLscy34eQsnQ5A-b7_Dc,All Things Music,"Response from the developers was fast. Immediately released an update, which was super cool. But still the same problem, app won't launch still. I'm using a zenfone 2 ZE550KL running android 5.0.2.",3
gp:AOqpTOHDDE2bHL3mDa9agy8fC4azUoqjvQUoAYDJYZTuKxBGY4D719w9kHKaI9Vsi75Iu_lL9lu2xEPK3RUah7s,Cora Liu,keep crashing after update. not the first time. byebye rubbish app.,1
gp:AOqpTOGCWkyjkBBgXi6SL2EF_UMketeLgqqflJD69M7HXEG2vjcBiDeS5nY79eM52dR6FaQ_hqYnG5CJyZj-1y4,Ben Bolivar,Crashes after application got updated. At least support is very responsive. An engineer reached out less than 24 hours after my post. App is critical during this time of crisis. I hope they get a patch out early.,3
